company,name,job,call,email,introduction,related_fields,career,education,eligibility,awards,assessment,performance,language,activity,url,new
김앤장,강인제,변호사,02-3703-4760 ,inje.kang@kimchang.com,"김·장 법률사무소의 강인제 변호사는 컴플라이언스 컨설팅, 부패방지·준법경영, 기업내부조사, 규제기관 조사 대응 등 업무를 수행하고 있습니다. 강 변호사는 디지털 포렌식(Digital Forensic), 머신러닝(Machine Learning) 및 AI/IT에 기반한 컴플라이언스 모니터링 시스템 체계 구축과 같은 리걸테크(Legal Tech) 분야에도 다양한 업무 경험을 갖고 있습니다.  강 변호사는 화학, 식품, 관광, IT, 유통, 기계, 자동차, 중공업, 철강, 전자, 제약, 방산 등 다양한 산업 분야의 고객사에게 기업 내 준법경영을 위한 컴플라이언스 시스템 구축, 강화 프로젝트를 이끌어 적시에 고객이 만족하는 성과를 도출하였습니다.  또한, 강 변호사는 제약, 의료기기, 식품, 화장품을 포함하는 헬스케어산업에 대한 풍부한 경험을 보유하여, 해당 분야의 다양한 고객사를 위하여 자문을 제공하고 있습니다. 구체적으로 산업 특유 규제, 공정거래, 광고, 인사·노무, 인수·합병, 대리점 관계 등과 관련된 법률 자문을 제공하였으며, 경찰, 검찰 및 공정거래위원회를 포함한 규제기관 대응이나 민/형사/행정 소송 단계에서도 외국계 및 국내 기업 고객사들을 대리하여 성공적으로 업무를 수행하였습니다.  특히 대규모기업집단 지주회사에 대한 컴플라이언스 강화 프로젝트, 여러 계열회사가 관계되는 컴플라이언스 위원회 설치 프로젝트와 같이, 해당 기업의 사업 특성, 규모, 인력 구성은 물론이고 계열사간 관계, 기업 문화 등을 충분히 이해하여야 하는 영역에서 뛰어난 전문성을 보이고 있습니다. 특히, 컨설팅을 진행하는 과정에서는 적법성을 담보하면서도 실효성을 확보한 솔루션을 제공하여야 현업과의 논의가 원활히 이루어지고 개선안이 실제로 현장에서 집행될 수 있는데, 강 변호사는 원활한 소통 능력에 기반하여 합리적 경영 판단, 문서관리체계 강화, 커뮤니케이션 문화 개선 등 프로젝트들에서 성과를 냈습니다.  강 변호사는 탁월한 발표 능력을 기반으로 고객사, 산업협회, 대학교, 해외 미디어 등 다양한 기관/단체에서 컴플라이언스, ESG, 부패방지, 산업특유 규제, AI/IT 활용 방안 등 강연을 진행하며 외부활동에 활발히 참여하고 있습니다.","부패방지·준법경영,제약·의료기기·식품·화장품,디지털포렌식·디스커버리,ESG,기업형사·화이트칼라범죄,공정거래,소송 +",김·장 법률사무소 (2015-현재),"University of San Diego School of Law (Visiting Scholar, 2023),대법원 사법연수원 (44기, 2015),제54회 사법시험 합격 (2012),서울대학교 (학사, 국사학 및 법학, 2010)","변호사, 대한민국 (2015),ISO 37001 ABMS (뇌물방지경영시스템) 인증심사원 (2017)",,,"컴플라이언스 컨설팅]]- 임직원 직업윤리, 준법문화 정착 방안//부패방지, 준법경영]]국내외 주요기업에 대한 해외 규제당국 조사 대응,국내외 주요기업의 FCPA 리스크 관리 체계 구축(제3자 대리인 관리 프로세스 포함),국내외 주요기업 내부조사 시행 자문,국내기업 대상 국민권익위원회의 청탁금지법 위반 협의 조사 대응,검찰, 경찰의 형법/청탁금지법 등 부패 혐의 조사 대응//Healthcare]]국내 주요 제약/의료기기사의 약사법, 의료기기법 등 특유 규제 이슈 자문,국내 주요 제약/의료기기사의 규제 개선, 완화, 법령 개정 프로젝트 수행,리베이트 쌍벌제 관련 경찰, 검찰 수사 대응,공정거래위원회의 제약/의료기기사 불공정거래행위 조사 대응,공정거래위원회의 부당한 공동행위, 사업활동방해 등 조사 대응,약사법, 의료기기법 위반 등 행정처분 대응,약사법, 의료기기법에 따른 지출보고서 작성 IT 솔루션 개발 및 회사 기존 IT 체계와 결합한 시스템 구축,국내 대기업의 제품 안전성 관리 체계 구축","한국어, 영어","“기업 경쟁력 강화를 위한 법무 혁신 전략” 지정토론 (국회 세미나, 2025),“컴플라이언스 시스템의 중요성 및 체계 강화 방안”, 컴플라이언스 마스터 클래스 (톰슨로이터 교육센터, 2025),“부패 리스크 식별, 평가 방안”, 기업 대상 청렴연수원 (국민권익위원회, 2025),“디지털 트랜스포메이션(Digital transformation)을 반영한 최신 컴플라이언스 시스템 구축 실무 및 전망”, 한국사내변호사회 ESG·컴플라이언스 분과 세미나 (한국사내변호사회, 2025),“최근 제약산업 정부조사 동향”, 2025 상반기 KPBMA 윤리경영 워크샵 (한국제약바이오협회, 2025),“준법통제시스템(컴플라이언스 프로그램) 구축/강화 실무”, 2025 내부감사전문교육 (한국감사협회, 2025),“부패방지 관련 기업 법률리스크 대응 방안”, 전사적 Risk Management 과정, (로앤비 교육센터, 2024),“컴플라이언스와 AI: 글로벌 트렌드와 주목할만한 이슈” 발표, KRPIA EBP Annual Workshop (한국글로벌의약산업협회, 2024),“준법통제시스템 구축 및 강화 실무”, 내부감사전문교육 (한국감사협회, 2024),“리베이트 유형 분석과 기업의 대응방안” 발표, 2023 제약산업 윤리경영 아카데미 (한국글로벌의약산업협회 및 한국제약바이오협회 공동개최, 2023),“부패방지 관련 기업 법률리스크 대응방안” 기업법무 단과 강의 과정 개설 (로앤비 교육센터, 2023),“ESG기반 법과 윤리” 발표, 서강대학교 ESG리더십 과정 (서강대학교, 2021, 2022, 2023),“임상시험지원 비용을 중심으로 한 세무조사에서의 유의점” 발표, 2022 한국제약바이오협회 윤리경영 워크샵 (한국제약바이오협회, 2022),“위기관리 대응 Internal Risk & External Crisis”, 2020 KRPIA 윤리경영 온라인 워크샵 (한국글로벌의약산업협회, 2020),“제약업계 최근 Compliance 동향 및 대응” 발표, 2020 제약산업 윤리경영 아카데미 & 워크샵 (한국제약바이오협회, 2020),“부패방지 관련 법률리스크 관리” 강의 (Thomson Reuters/LAWnB, 2018),“제2기 의약품·의료기기 리베이트 예방 및 공정거래 특화과정” 강의 과정 개설 (한국보건복지인력개발원, 2018),“Healthcare 산업의 규제동향과 기업의 대응” 강의, IHCF healthcare 분과 세미나 (인하우스카운슬포럼, 2017),“지출보고서 가이드라인의 주요 내용과 예상되는 문제상황 및 대응방안” 발표, KRPIA EBP 워크샵 (한국글로벌의약산업협회, 2017),“공정경쟁규약 개정 주요사항 및 시사점” 발표, 2017 KMDIA 윤리위원회 워크샵 (한국의료기기산업협회, 2017),“의료기기 업계가 알아야 할 청탁금지법(김영란법) 설명회” 발표 (한국의료기기산업협회, 2016) 외 다수",https://www.kimchang.com/ko/professionals/view/Inje%20KANG,-
김앤장,강한철,변호사,02-3703-1412 ,hckang@kimchang.com,"김·장 법률사무소의 강한철 변호사는 주로 Compliance, 부패방지, 준법경영, 기업내부조사 등의 업무를 수행하면서, Digital Forensic과 E-discovery 분야에서도 다양한 경험을 갖고 있습니다.강 변호사는 다수의 국내 대기업과 중견기업들을 위한 Compliance System 구축 업무를 수행하여 기업준법 태세를 정비하는데 조력하였습니다. 아울러 제약, 의료기기, 식품, 화장품 및 동물의약품을 포함한 보건의료산업 분야에 풍부한 경험을 보유하여 해당 산업 분야의 고객사들을 위하여 산업규제, 인사노무, 인수·합병, 합작투자, 라이선싱 및 대리점관계 등과 관련한 법률적 자문을 제공하여 왔습니다. 강 변호사는 글로벌 제약, 의료기기, 바이오 기업들을 포함한 외국계 고객사들을 위하여, 공정거래법, 리베이트 규제 및 보험약가 이슈 관련 조언을 하여 왔고, 검찰 및 공정거래위원회를 포함한 규제기관 대응 과정에서 고객사들을 대리하여 업무를 수행한 바 있습니다.강 변호사는 김·장 법률사무소에 합류하기 이전 대한민국 공군 군판사 및 항공우주법 연구위원회 위원으로 근무하였습니다. 지난 2012년 혁신형제약기업 인증위원회 위원으로 활동하였고, 2013년 싱가포르에 위치한 Allen & Gledhill LLP에서 파견변호사로 업무 수행하였습니다. 미국 코넬대학교 로스쿨에서 법학석사학위를, 영국 런던대학교 보건대학원에서 보건경제학석사학위를 각 취득한 후 미국 뉴욕주 변호사 자격을 취득하였습니다. 이후 서울대학교 법학전문대학원에서 전문박사과정을 수료하였습니다.강 변호사는 2015년 9월에 ALB(Asian Legal Business)가 아시아 지역의 40세 미만 변호사를 대상으로 주목할 만한 40인을 선정한 ‘ALB 40 Under 40 List’에 이름을 올렸습니다. 국내 변호사로서 선정된 3명 중 한 명이었으며, 국내 Compliance 및 보건의료산업 분야에서는 유일하였습니다. 또한 The Asia Legal Award의 Corporate Compliance 분야에서 2017년과 2018년 연속하여 7명의 Finalist에 선정되기도 하였습니다. 강 변호사는 2016년 싱가포르에서 개최된 2016 APAC Pharma Compliance Congress에 참석하여 발표하는 등 활발한 국제활동을 하고 있고, 제약회사 건강캠페인 규제의 타당성 검토(규제연구 제22권 제1호, 2013.6.)와 임상시험심사위원회(IRB)의 리베이트 통제 역할에 관한 소고(인권과 정의 통권 제434호, 2013.6.)를 포함한 다수의 연구논문을 저술하였습니다.","제약·의료기기·식품·화장품 +,부패방지·준법경영 +,기업형사·화이트칼라범죄,디지털포렌식·디스커버리 +,인사·노무,공정거래,기업인수·합병 +,외국인투자,베트남,중대재해 대응,프라이버시·정보보호,사이버 사고 대응","Allen Gledhill LLP, Singapore (2013),보건복지부 산하 혁신형제약기업 인증위원회 위원 (2012),김·장 법률사무소 (2007-현재),공군 항공우주법 연구위원회 연구위원 (2004-2007),공군본부 군사법원 군판사 (2004-2007)","University of London, LSHTM (보건학석사, 2018),서울대학교 법학전문대학원 (법학전문박사과정 수료, 2015),Cornell Law School (법학석사, 2013),The Wharton School Executive Program: Making an Impact as a Global Health Leader (2013),서울대학교 대학원 법학과 (민법학석사, 2007),대법원 사법연수원 (33기, 2004),서울대학교 법과대학 (학사, 2002),제42회 사법시험 합격 (2000)","변호사, 대한민국 (2004); 뉴욕주 (2015)","공군참모총장 표창 (2006, 항공우주법 연구업무 유공),산업자원부장관상 (2005, 유전자안전성 연구논문상),공군참모총장 표창 (2004, 항공우주법 연구업무 유공),Stand-out Lawyer - Independently Rated Lawyers (Thomson Reuters, 2025)",,"국내외 주요기업 compliance system 구축,국내외 주요기업 내부조사 시행 자문,국내외 주요기업 해외분쟁 eDiscovery 업무 자문,공정거래위원회의 1차, 2차, 3차 제약사 불공정거래행위 조사 대응,공정거래위원회의 특허권남용 조사 대응,쌍벌제 리베이트 수사 관련 대응,글로벌 제약사 compliance SOP 구축,License 및 Distribution 계약 체결,Co-promotion, Distribution 계약 해지,약사법, 의료기기법 위반 행정처분 대응,의약품, 의료기기, 식품, 화장품 제조물 책임 분쟁해결,임상시험 중 부작용 관련 자문 의료기관 설립 관련 자문","한국어, 영어","이사의 준법경영의무에 관한 소고 - 실무적 쟁점과 최근 판례 경향의 분석, BFL 제113호 (서울대학교 금융법센터, 2022),Lexology Getting the Deal Through - ESG & Impact Investing 2022: Korea Chapter (공저, Law Business Research, 2021),제약산업 윤리경영 어디까지 왔나? (제약협회 정책보고서 제2호, 2014.8.),제약회사 건강캠페인 규제의 타당성 검토 (규제연구 제22권 제1호, 2013.6.),임상시험심사위원회(IRB)의 리베이트 통제 역할에 관한 소고 (인권과 정의 통권 제434호, 2013.6.),약사법상 의약품 동정적 사용제도 (한국의료법학회지 제21권 제1호, 2013.6.),연구논문: 임의비급여 관련 진료비 청구요건으로서의 의학적 필요성에 대한 검토 (저스티스 통권 제135호, 2013.4.),제약협회 공정경쟁규약의 개정필요성과 개선방안 (한국의료윤리학회지 제16권 제1호, 2013.4.),해외 보건의료산업의 투명성 강화 제도와 국내 시사점: 미국 선샤인 액트(Sunshine Act)와 일본 투명성 가이드라인을 중심으로 (법조 제62권 제4호, 2013.4.),미국 기업준법약정(Corporate Integrity Agreement) 제도와 국내 시사점: 보건의료산업을 중심으로 (인하법학연구 제16권 제1호, 2013.3.),미국 환자보호 및 의료비용합리화법(the Patient Protection and Affordable Care Act)과 의료에 있어서의 사적 자치의 원칙 (한양대학교 법학논총 제30권 제1호, 2013.3.),전문의약품 대중광고 규제완화 논의에 대한 소고: 미국, 캐나다 및 유럽연합의 사례를 중심으로 (연세대학교 법학연구 제23권 제1호, 2013.3.),시판후의약품 허가사항 초과사용(Off-Label Use)과 그 홍보활동으로 인한 법적 책임: Qui Tam Action 도입론의 비판적 검토를 중심으로 (이화여자대학교 법학논집 제17권 제3호, 2013.3.),요양기관당연지정제의 법정책적 타당성에 대한 소고: 헌재 99헌바76 결정례에 대한 비판적 검토를 중심으로 (법과정책연구 제13권 제1호, 2013.3.),임상시험과 환자를 위한 구체적 의료행위의 구분기준에 관한 고찰: 대법원 2010. 10. 14. 선고 2007다3162 판결에 대한 비판적 검토를 중심으로 (서울대학교 법학 제54권 제1호, 2013.3.),의사의 배임수재죄에 있어서의 타인의 사무 개념 (고려법학 통권 제68호, 2013.3.),의료 관련 구매대행회사(Group Purchasing Organization)의 법적 문제 (서울법학 제20권 제3호, 2013.2.),연구자주도임상 관련 재정적 지원의 법률적 문제점에 대한 검토 (한국의료법학회지 제20권 제2호, 2012.12.),항공기담보제도의 현황과 발전방향에 관한 연구 (서울대학교 석사학위 논문, 2007),유전자변형생물체 이용에 따른 분쟁의 적정한 사법적 해결제도 연구 (BIOSAFETY JOURNAL 통권 제22호, 2005.3.),인공위성의 군사적 활용 및 통제방안에 관한 법률적 검토 (항공우주법학회지 제20권 제2호, 2005.1.),한국민사법학회, 2014 학술대회 “의료행위의 민사책임 판단 기준으로서의 표준진료지침 도입론에 대한 비판적 검토” 주제논문 발표 (2014),한국보건복지인력개발원, 2013 제약기업관리자 전략과정 “의약품관련 외국의 공정거래 규정과 위반사례”, 강의 (2013),한국제약협회, 위기의 제약산업 신뢰회복 및 발전방안 세미나, 주제발표 (2012),한국다국적의약산업협회, 2011 KRPIA Code Workshop, 패널 (2011),데일리팜, 제약산업 미래포험 “사회적 통념 어디까지 인정할 것인가”, 주제발표 (2011),약업신문, 리베이트 쌍벌제 법률적 해석과 적용, 특별기고 (2011)",https://www.kimchang.com/ko/professionals/view/hckang,-
김앤장,고건영,변호사,02-3703-1723 ,geonyoung.go@kimchang.com,"김·장 법률사무소의 고건영 변호사는 국가·공공기관·공기업 관련 공공 계약, 방위 사업 및 방산보안 분야에서 법률자문을 제공하고 있습니다. 국내외 주요 방산 기업이 관련된 국내 소송과 국제 중재 및 외국 소송(미국, 싱가포르)에 대한 풍부한 경험을 보유하고 있습니다.  고 변호사는 공군 법무관으로 20년 간 공군과 방위사업청의 국제 계약, 국내 계약, 방위사업 실무 및 관련 민사, 행정, 형사 사건 처리 경험을 쌓았습니다. 특히 방위사업청에서는 4년 간 국제 중재 및 외국 소송을 전담 수행하여 미국·독일·이스라엘 등 국외 방산 현황과 미국 FMS·상업구매 및 절충교역 관련 지식을 보유하고 있으며, 공군 근무 시에는 국내외 전투기 제작사와의 사고 배상 협상에 직접 참여하기도 하였습니다. 2024년 공군 중령으로 전역한 후 김·장 법률사무소에 합류하여 공공조달 및 방위산업팀의 구성원으로 활동하고 있습니다.  고 변호사는 방위사업청 재직시 방위사업교육원의 ‘법령해석 및 판례 이해 과정’ 강사로서 방위사업청, 경찰청, 방산업체 구성원을 대상으로 수년 간 ‘국제중재 및 국외소송’ 과목을 강의하였습니다. 2019년에는 민홍철 국회의원 주관 군사법발전토론회에서 ‘디지털 포렌식 등 과학수사 발전 방안’을 발표하기도 하였습니다.","방위산업 +,공공계약,산업안보 및 수출통제,국제중재·소송,관세 및 국제통상 분쟁,디지털포렌식·디스커버리,소송 +","한국우주안보학회 연구이사 (2025-현재),방위사업청 방산수출심의위원회 위원 (2024-현재),김·장 법률사무소 (2024.10.-현재),방위사업청 혁신행정법무담당관실 항공송무담당 (2020.12.-2024.9.),방위사업청 연구용역사업 제안서 평가위원 (2023),방위사업청 방위사업교육원 “국제중재 및 국외소송” 강사 (2021-2023),공군본부 법무과장 (2020),국방부 특별수사단 제2부장 (2019),공군 고등검찰부장 (2019),공군 작전사령부 법무실장 (2018),공군본부 법제과장 (2017),합동참모본부 무기체계 시험평가위원회, 시험평가실무위원회 법무위원 (2016),합동참모본부 항공작전법담당 (2016),고등군사법원 군판사 (2015),공군본부 법무과 법무계획담당 (2013-2014),공군 군사법원 군판사 (2011-2013),공군 미사일방어사령부 법무실장 (2010),공군 작전사령부 작전법담당 (2009),공군 군사법원 행정과장 (2008),공군본부 법제과 항공법담당 (2007)","University of Southern California, Gould School of Law (LL.M., 2012),Defense Institute of International Legal Study, DSCA, US (Military Law Development Program, Anti-Corruption Program, Peacekeeping Operations in accordance with the Rule of Law Program, 2010),대법원 사법연수원 (군법무관, 18기, 2007),제18회 군법무관임용시험 합격 (2004),성균관대학교 (법학사, 2003)","변호사, 대한민국 (2007), 뉴욕주 (2013),국제무역사 (2022)","방위사업청장 표창 (송무 업무 유공, 2021),국무총리 표창 (항공기 사고배상협상 유공, 2018),공군작전사령관 표창 (작전법 지원 유공, 2018),합참의장 표창 (2016),공군참모총장 표창 (UFG연습 유공, 2014),법무부장관 표창 (법제 업무 유공, 2007)",,,"한국어, 영어, 일본어","“군검찰 과학수사(디지털포렌식) 발전방안” 발표, 민홍철의원실 군사법 발전방향 토론회 (국회, 2019)",https://www.kimchang.com/ko/professionals/view/geonyoung.go,-
김앤장,권강,변리사,02-6488-4020 ,kkwon@kimchang.com,"권강 변리사는 김·장 법률사무소의 지적재산권 그룹의 일원으로서, 전기, 전자, 소프트웨어 등의 기술에 관한 특허소송/심판 및 출원, 특허 침해 및 유효성 감정, 선행기술 조사, 영업비밀 분쟁 등의 업무를 주로 담당하고 있습니다.특히, 반도체, 디스플레이, 스마트폰 등의 분야에서 글로벌 기업을 대리하여 국내 대규모 특허소송 및 심판을 성공적으로 수행하였습니다. 또한, 2017년 캘리포니아 변호사 자격 취득 이후에는 미국 지방법원 및 ITC에서의 특허/영업비밀 소송 및 IPR 사건 지원 업무를 다수 담당해오고 있으며, 유럽 및 중국 특허 소송 지원 업무도 담당하고 있습니다.","특허·실용신안,전기·반도체,컴퓨터∙소프트웨어,미국,중국(IP),디지털포렌식·디스커버리,지식재산권 해외 분쟁","김·장 법률사무소 (2009-현재),그래텍 (2004-2005),카마디지털엔터테인먼트 (2003-2004)","Stanford Law School (LL.M., Law, Science & Technology, 2016),한국방송통신대학교 법학과 (2014),서울대학교 전기공학부 (2008)","변호사, 캘리포니아주 (2017),변리사, 대한민국 (2008)","Next Generation Partner, The Legal 500 Asia Pacific: Intellectual property: PATMA (Legalease, 2024-2026)",,"해외 IP 분쟁]]한국 회사의 경쟁사 상대 태양광 분야 글로벌 특허분쟁 사건(미국 지방법원사건, ITC 사건, IPR 사건, CAFC 항소심, 독일 특허침해소송 및 특허무효소송, EPO opposition, 중국 특허침해소송 및 무효심판 등),한국 회사의 경쟁사 상대 미국 ITC 영업비밀침해소송 공격 사건,한국 회사의 경쟁사 상대 미국 ITC 특허침해소송 공격 사건,미국 회사의 NPE 상대 무선통신 표준기술 분야 미국 지방법원 특허침해소송 방어 사건 지원,한국 회사의 경쟁사 상대 자동차 분야 미국 지방법원 특허침해소송 방어 사건 디스커버리 지원,한국 회사의 경쟁사 상대 지문인식 분야 미국 지방법원 특허침해소송 방어 사건 디스커버리 지원,한국 회사의 경쟁사 상대 가전제품 분야 미국 지방법원 특허침해소송 방어 사건 디스커버리 지원//국내 IP 분쟁]]한국 금융 회사의 NPE 상대 BM 특허침해소송 방어 사건 및 관련 무효심판 사건,한국 회사의 경쟁사 상대 반도체 제조 부품 분야 특허침해소송 공격 사건 및 관련 무효심판 사건,한국 회사의 경쟁사 상대 전력량계 분야 특허침해소송 방어 사건 및 관련 무효심판 사건,글로벌 한국 회사의 디스플레이 분야 경쟁사 상대 특허침해소송 공격/방어 사건 및 관련 무효심판 사건,글로벌 스마트폰 제조회사의 경쟁사 상대 무선통신 표준기술 분야 특허침해소송 공격/방어 사건,글로벌 LED 제조회사의 경쟁사 상대 특허침해소송 공격/방어 사건 및 관련 무효심판 사건,글로벌 반도체 장비 회사의 영업비밀 유출 혐의 방어 사건,한국 포털 업체의 기술탈취 소송 방어 사건//특허 출원 및 분석]]국내 특허 출원 및 중간 사건 담당(반도체, 디스플레이, 통신, 네트워크, 영상기술, 소프트웨어, 스마트폰, 전자상거래 등의 기술분야),선행기술조사(반도체, 디스플레이, 통신, 네트워크, 영상기술, 소프트웨어, 스마트폰, 전자부품, 로봇 등의 기술분야),특허 무효/침해 분석 및 감정서 작성(디스플레이, 가스터빈 발전기, 핀테크 기술분야)//기타 업무]]미국 도로교통안전국(NHTSA) 조사 대응 업무 관여,호주 ACCC/ESV 조사 대응 업무 관여,가스터빈 발전기 사고 관련 불법행위 손해배상 소송 관여,자율주행 분야 합작회사 설립 관련 IP 실사 업무 관여,원자력 분야 지분투자 관련 IP 실사 업무 관여,소프트웨어 분야 저작권 침해 및 부정경쟁행위 소송 관여,SI 분야 손해배상 소송 관여,글로벌 회사의 관세 품목분류 사건 관여,글로벌 소프트웨어 회사에 대한 공정거래위원회 조사 사건 관여,글로벌 부품 회사에 대한 공정거래위원회 조사 사건 포렌직 업무 관여","한국어, 영어",Wipi Mobile Game Programming (2005),https://www.ip.kimchang.com/ko/professionals/view/kkwon,-
