company,name,job,call,email,introduction,related_fields,career,education,eligibility,awards,assessment,performance,language,activity,url,new
김앤장,박건찬,고문,02-6390-2670 ,geonchan.park@kimchang.com,"김·장 법률사무소의 박건찬 고문은 부패방지·준법경영, 기업형사·화이트 칼라 범죄, 기업 정보보호, 일본 등 분야에서 자문을 제공하고 있습니다. 기업 거버넌스와 컴플라이언스 분야에 대한 깊은 이해를 바탕으로 다년간 기업 내부 범죄수사활동을 수행해왔을 뿐만 아니라, 산업 보안(물적·인적 보안) 분야에 전문적 지식을 가지고 있습니다. 특히 일본지역 법 집행기관과의 협력을 바탕으로 재외국민 보호 활동 및 기업 진출 지원 등 풍부한 국제 경험을 가지고 있습니다.  박 고문은 서울 주요 경찰서 재산범죄 및 화이트칼라범죄 조사분야 책임자, 경찰서장·청장 등으로 근무하며 조직관리 및 지역 법질서 확립에 기여하였고, 경호실 파견 및 경비국 근무를 통해 시설 물적 보안 분야에 전문성을 가지고 있습니다. 또한 일본 경찰대학 파견 및 주오사카 경찰주재관, 주후쿠오카 총영사 등 다양한 국제 업무를 수행하며 국민 보호와 기업 진출 지원 등을 총괄하였습니다.  박 고문은 경북 자치 경찰 특별고문경〮일대학교 경찰행정학과 교수로 활동한 바 있으며 관련 분야 강연 활동 및 자문을 제공하고 있습니다.","기업형사·화이트칼라범죄,부패방지·준법경영,지식재산권 +,일본","김·장 법률사무소 (2025-현재),주후쿠오카 대한민국 총영사 (2022.9.-2025.7.),경일대 경찰행정학과 교수∙경상북도 자치경찰 특별자문 (2021.3.-2021.8.),경북경찰청장 (2019.12.-2020.8.),울산경찰청장 (2018.12.-2019.12.),중앙경찰학교장 (2017.12.-2018.12.),경기남부지방경찰청 차장 (2017.1.-2017.12.),경찰청 경비국장 (2016.12.-2017.1.),서울청 경비부장 (2015.12.-2016.12.),대통령 경호실 경찰관리관 (2014.2.-2015.12.),경찰청 경비과장 (2011.12.-2014.1.),서울경찰청 종로경찰서장 (2010.12.-2011.12.),서울경찰청 제1기동단장 (2010.1.-2010.12.),경북 청송경찰서장 (2008.3.-2009.3.),경찰청 수사연수원 교무과장 (2007.2.-2008.3.),일본 주오사카총영사관 경찰주재관 (2003.2.-2007.2.),충남 대전동부 수사∙형사과장 (1998.7.-1999.2.),서울 종암∙관악∙청량리 조사계장 (1993.5.-1998.7.)","동국대학교 대학원 (박사, 경찰학, 2020),일본 동경도립대학 대학원 (석사, 법학, 2002),일본 경찰대학교 (경부과정, 1995),경찰대학교 (학사, 행정학, 1988)","산업보안관리사, 대한민국 (2017),공인중개사, 대한민국 (2016),행정사, 대한민국 (2013)","근정포장 (2014),대통령표창 (2010)",,"국내 중소기업 대상 컨플라이언스 강화 자문,기업 정보 유출에 대한 물적 보안 대비책 자문,진출 기업 대상 자문 및 상담,해외동포 법률자문 및 해외 법 집행기관과의 연계 강화","한국어, 일본어","인절미 스무 개, 물 열 컵 (생각나눔, 2022),자치경찰제 도입에 따른 신임경찰 교육훈련방안 연구-전문가 델파이 조사를 중심으로- (박사학위 논문, 2020),“억제 요인이 경찰공무원 비위행위 인식에 미치는 영향”, 한국범죄심리연구 (학술논문, 2019),“일본경찰 개혁의 경위와 개요”, 치안정책연구 (학술논문, 2002),한일 조직범죄의 실태와 법적대응에 관한 비교-한국에서의 적응모델의 모색- (석사학위 논문, 2002)",https://www.kimchang.com/ko/professionals/view/geonchan.park,-
김앤장,박관우,변호사,02-3703-5831 ,kwanwoo.park@kimchang.com,"김·장 법률사무소의 박관우 변호사는 제약, 의료기기, 식품, 화장품 등 헬스케어 산업에 대한 풍부한 경험을 바탕으로 해당 분야의 다양한 고객사를 위하여 산업 특유의 규제, 부패방지·준법경영, 행정쟁송 관련 폭넓은 법률 자문 서비스를 제공하고 있습니다.박 변호사는 글로벌 제약, 의료기기, 바이오 기업들을 포함한 고객사들을 위하여 리베이트 및 보험약가 등의 산업규제, 공정거래, 형사, 인사노무, 인수·합병 등과 관련한 법률적 자문을 제공하여 왔습니다. 특히 약가와 치료재료 업무에 대한 다양한 자문 경험을 바탕으로 초고가 치료제, 유전자 치료제, 항암·희귀 질환 치료제, 그리고 고가의 의료장비나 소모성 의료기기 등 혁신적 신약과 의료기기가 건강보험체계로 편입되어 상용화될 수 있도록 하는 업무를 성공적으로 수행한 바 있습니다.박 변호사는 김·장 법률사무소에 합류하기 이전에는 약사로서 근무한 경험이 있으며, 변호사로서 건강보험심사평가원, 식품의약품안전처에 재직하는 등 여러 규제기관에서의 근무경험이 있습니다.","제약·의료기기·식품·화장품,부패방지·준법경영,공정거래,소송 +,행정 소송 및 행정 구제,보험 소송","김·장 법률사무소 (2020-현재),강동경희대병원 연구윤리심의위원회(IRB) 위원 (2019-2020),삼성서울병원 연구윤리심의위원회(IRB) 위원 (2019-2020),건강보험심사평가원 (2016-2020),법무부 공익법무관 (2015-2016),식품의약품안전처 공익법무관 (2014-2015),서울중앙지방검찰청 공익법무관 (2013-2014)","서울대학교 법과대학원 (박사과정 수료, 2022),제2회 변호사시험 합격 (2013),전남대학교 법학전문대학원 (법학전문석사, 2013),삼육대학교 (약학사, 2009)","변호사, 대한민국 (2013),약사, 대한민국 (2009)",,,"신약 급여등재 전략 분석 및 등재 관련 자문,신약 급여기준 확대, 재평가 등 사후관리 관련 자문,위험분담계약 등 공단과의 협상 관련 자문,글로벌 제약사 Compliance Standard Operating Procedures (SOP) 구축,M&A와 관련된 Regulatory 업무,의료기기 신의료기술평가(혁신의료기술평가) 관련 자문,치료재료 재평가(원가조사) 상한금액 인하 대응,의약품, 의료기기 허가 관련 자문,리베이트 관련 자문,디지털 의료기기 상용화 관련 자문,약사법, 의료기기법 위반 행정처분 대응,약가 제도개선 연구용역 수행,지출보고서 연구용역 수행,기능성 화장품 관련 자문","한국어, 영어",,https://www.kimchang.com/ko/professionals/view/kwanwoo.park,-
김앤장,박민규 (Stephane Min Gyu PARK),외국변호사,02-3703-1920 ,stephane.park@kimchang.com,,"기업형사·화이트칼라범죄,부패방지·준법경영,인사·노무,금융규제 및 컴플라이언스 +,제약·의료기기·식품·화장품,기업지배구조·경영권분쟁 +,기업인수·합병 +,은행,보험","김·장 법률사무소 (1997-2003, 2011-2015, 2018-현재),General Counsel / Head of Legal and Compliance, 푸르덴셜생명 (2015-2018),Director, Head of Legal and Compliance, Credit Suisse AG 서울 (2003-2011),Coudert Brothers (1995-1997)","University of California, Hastings College of the Law (J.D., cum laude, 1995),University of California, Berkeley (B.A., Economics and French Literature, 1992)","외국변호사, 뉴욕주 (1997)",,,,"영어, 한국어, 프랑스어","Practical Law - Insurance and Reinsurance in South Korea: Overview (공저, Thomson Reuters, 2025),Regulatory Intelligence - South Korea: Insurance (공저, Thomson Reuters, 2024-2025)",https://www.kimchang.com/ko/professionals/view/stephane.park,-
김앤장,박산,변호사,02-6678-2859 ,san.park@kimchang.com,,"소송 +,기업형사 소송,부패방지·준법경영,회사법","김·장 법률사무소 (2024-현재),서울고등법원 재판연구원 (2022-2024),서울고등법원 춘천재판부 재판연구원 (2021-2022)","제10회 변호사시험 합격 (2021),성균관대학교 법학전문대학원 (법학전문석사, 2021),연세대학교 (경영학사, 2018)","변호사, 대한민국 (2021)",,,,"한국어, 영어",,https://www.kimchang.com/ko/professionals/view/san.park,-
김앤장,박상길,변호사,02-3703-1714 ,sangkil.park@kimchang.com,,"기업형사·화이트칼라범죄,부패방지·준법경영","포스코 홀딩스 비상임 고문 (2022-2024),포스코 사외이사 (2011-2013),김·장 법률사무소 (2008-현재),부산고등검찰청 검사장 (2007),대전고등검찰청 검사장 (2006),대구지방검찰청 검사장 (2005),대검찰청 중앙수사부장 (2004),대법원 사법개혁위원회 위원 (2003),법무부 기획관리실장 (2003),서울남부지방검찰청 검사장 (2002),서울지방검찰청 제3차장검사 (2001),대검찰청 중앙수사부 수사기획관 (2000),서울지방검찰청 의정부지청 차장검사 (1999),서울지방검찰청 특별수사 제3부장 (1997), 제2부장 (1998), 제1부장 (1999),대검찰청 중앙수사부 제3과장 (1995), 제2과장 (1996), 제1과장 (1997),대검찰청 감찰부 제2과장 (1993),법무부 검찰국 검사 (1992),창원지방검찰청 충무지청장 (1991),법무부 법무실, 검찰국 검사 (1982, 1988),서울지방검찰청 검사 (1979, 1987, 1990)","Stanford Law School (V.S., 1990),Harvard Law School (LL.M., 1987),대법원 사법연수원 (9기, 1979),제19회 사법시험 합격 (1977),서울대학교 (법학사, 1976)","변호사, 대한민국 (1979)","황조근정훈장 (2007),홍조근정훈장 (2001),법무부장관 표창 (1989)",,,"한국어, 영어","미국의 증거배제법칙 비판 (1994),미국의 형사절차 개관 (1992),기소사실인부 및 유죄답변제도 (1989),미국에서의 법정자백과 형사절차 (1987)",https://www.kimchang.com/ko/professionals/view/sangkil.park,-
김앤장,박상혁,외국변호사,02-3703-1783 ,sang.park@kimchang.com,,"공정거래,기업인수·합병 +,기업지배구조·경영권분쟁 +,부패방지·준법경영,소송 +,프라이버시·정보보호,게임·리조트·엔터테인먼트,기업형사·화이트칼라범죄,방송·통신,사이버 사고 대응,홍콩,해외법무,유럽 +,프랑스,독일","김·장 법률사무소 (2009-현재),Dechert LLP (Associate, 1996-2002; Partner, 2003-2009),김·장 법률사무소 (1994-1996)","Cornell Law School (J.D., 1993),University of Chicago (B.A., 1990)","외국변호사, 뉴욕주 (1993)",,,,"영어, 한국어","The Asia-Pacific Antitrust Review 2018 (공저, Law Business Research, 2018),Getting the Deal Through - Government Relations: Korea chapter (공저, Law Business Research, 2018),Chambers Global Practice Guide - Corporate M&A 2017: Korea chapter (공저, Chambers & Partners, 2016),Chambers Legal Practice Guides - Corporate M&A 2015 (2nd Edition): Korea chapter (공저, Chambers & Partners, 2015),GCR The Asia-Pacific Antitrust Review 2014: Korea chapter (공저, Law Business Research, 2014),European Lawyer Reference - Mergers & Acquisitions (First edition): Korea chapter (공저, Thomson Reuters, 2012),Getting the Deal Through - Foreign Investment Review 2012: Korea chapter (공저, Law Business Research, 2012),The 2011 guide to Mergers and Acquisitions: Korea chapter, “Reform and consolidation” (공저, IFLR, 2011),Getting the Deal Through - Mergers & Acquisitions: Korea chapter (공저, Law Business Research, 2010-2013),The Mergers & Acquisitions Review: Korea chapter (공저, Law Business Research, 2010-2012),The 2010 guide to Mergers and Acquisitions: Korea chapter, “Expansion in 2010?” (공저, IFLR, 2010)",https://www.kimchang.com/ko/professionals/view/sang.park,-
김앤장,박선정 (Sunny J. PARK),외국변호사,02-3703-1780 ,sunny.park@kimchang.com,,"방송·통신,프라이버시·정보보호,부패방지·준법경영,공정거래","김·장 법률사무소 (1997-1999, 2023-현재),주한미국상공회의소 IT 분과위원회 공동위원장 (2011-2018),소프트웨어연합 한국 의장 (2011-2018),Microsoft Corporation (2010-2023),법무법인 서정 (2006-2010),아리랑국제방송 ""In Focus"" 사회자 (2002-2007),법무법인 지평 (2004-2006),Locus Technologies (2000-2004)","Syracuse University School of Law (J.D., cum laude, 1997),Syracuse University (M.B.A., Marketing/International Business, 1991),Syracuse University (B.S., Retailing/Marketing, 1989)","외국변호사, 뉴욕주 (2000); 뉴저지주 (1997)",,,,"영어, 한국어",,https://www.kimchang.com/ko/professionals/view/sunny.park,-
김앤장,박소영,변호사,02-3703-8044 ,soyeong.park@kimchang.com,,"제약·의료기기·식품·화장품,공정거래,공정거래 소송,부패방지·준법경영,소송 +",김·장 법률사무소 (2022-현재),"제11회 변호사시험 합격 (2022),고려대학교 법학전문대학원 (법학전문석사, 2022),고려대학교 (학사, 국제학, 2019)","변호사, 대한민국 (2022)",,,,"한국어, 영어",,https://www.kimchang.com/ko/professionals/view/soyeong.park,-
김앤장,박슬기,변호사,02-3703-4875 ,seulgi.park@kimchang.com,"김·장 법률사무소의 박슬기 변호사는 각 산업군에 대한 다양한 업무 경험을 바탕으로 공정거래, 준법경영 등 기업법무 분야에서 법률자문을 제공하고 있습니다.특히, 박 변호사는 공정거래 분야에서 시장지배적지위 남용행위, 불공정거래행위, 부당지원, 부당공동행위 등 다양한 이슈에 대한 조사 대응 및 자문을 제공하고 있으며, 공정거래위원회 뿐만 아니라 검찰, 법원, 중소기업벤처부 등 유관 기관 및 부서의 대관 업무에 대한 폭넓은 경험을 가지고 있습니다.","공정거래,부패방지·준법경영,기업형사·화이트칼라범죄",김·장 법률사무소 (2017-현재),"대법원 사법연수원 (46기, 2017),성균관대학교 (경제학사, 2017),제55회 사법시험 합격 (2013)","변호사, 대한민국 (2017)",,,"국내 제강사의 부당공동행위 관련 조사 대응 및 소송 대리,국내 가구사의 부당공동행위 관련 조사 및 수사 대응,국내 건설사의 부당지원행위 관련 조사 대응,국내 유통사의 불공정거래행위 관련 조사 및 수사 대응,해외 TMT 기업의 시장지배적지위 남용행위 관련 조사 대응,해외 TMT 기업의 불공정거래행위 관련 조사 대응,하도급법 관련 공정위, 중기부 조사 대리 및 관련 자문,다수 지주회사의 지주회사 행위제한 관련 자문,각종 산업분야에서의 기업결합신고 관련 자문 및 대리,공정거래 및 컴플라이언스 관련 사내 교육","한국어, 영어",,https://www.kimchang.com/ko/professionals/view/seulgi.park,-
김앤장,박완빈,변호사,02-3703-1760 ,wanbin.park@kimchang.com,,"제약·의료기기·식품·화장품,공정거래,부패방지·준법경영,방위산업","김·장 법률사무소 (2009-현재),한국의료기기안전정보원(NIDS) 첨단AI 기반 디지털의료기기 신속제품화 지원 사업(AX-SPRINT 300) 과제 선정 평가위원 (2026. 2.),해군법무관 (2006-2009)","University of San Diego School of Law (Visiting Scholar, 2015),대법원 사법연수원 (35기, 2006),서울대학교 (학사, 경제학, 2003),제44회 사법시험 합격 (2002)","변호사, 대한민국 (2006)","Stand-out Lawyer - Independently Rated Lawyers (Thomson Reuters, 2025-2026),Rising Star : 헬스케어 (리걸타임즈, 2024),Korea Super 30 Lawyers, Asian Legal Business (Thomson Reuters, 2021-2023)",,,"한국어, 영어","Chambers Global Practice Guides - Medical Devices & Consumer Health Products 2022: Korea Chapter (공저, Chambers and Partners, 2022)",https://www.kimchang.com/ko/professionals/view/wanbin.park,-
김앤장,박재홍,변호사,02-3703-4622 ,jaehong.park@kimchang.com,"김·장 법률사무소의 박재홍 변호사는 은행, 증권, 자산운용 등 금융 산업 분야에서 기업인수·합병, 사모투자, 금융규제 및 컴플라이언스, 은행·증권·금융 소송 등의 기업법무에 대하여 법률 자문을 제공합니다. 주요 고객사로는 국내외 은행, 증권사, 자산운용사, 사모펀드 및 벤처캐피탈 등이 있습니다.박 변호사는 사법연수원 수료 이후 군법무관으로 재직하는 동안, 국방부 소속 군법무관으로서 대한민국을 대리하여 수많은 국가소송을 수행한 경험이 있습니다. 김·장 법률사무소 재직 중인 2014년에는 PLC Private Equity & Venture Capital Multi-jurisdictional Guide 에 “Venture Capital Investment in South Korea: Market and Regulatory Overview"" 를 게재하였습니다.","기업인수·합병 +,사모투자,금융규제 및 컴플라이언스 +,은행·증권·금융 소송,은행,자산운용,부패방지·준법경영,기업형사·화이트칼라범죄,소송 +","김·장 법률사무소 (2013-현재),해군법무관 (2010-2013)","대법원 사법연수원 (39기, 2010),서울대학교 (경영학사, 2007),제49회 사법시험 합격 (2007)","변호사, 대한민국 (2010)",,,"기업 인수·합병]]국내 금융기관 간 인수·합병 자문,국내 Fin-tech 및 IT 기업 간 인수·합병 자문,국내 벤처기업 간 인수·합병 자문,국내 대형숙박기업 인수·합병 자문//사모투자]]경영참여형 사모집합투자기구(PEF) 설립 및 투자 자문//금융 규제 및 컴플라이언스]]국내 주요 금융 기관들의 금융 규제 및 컴플라이언스 점검 및 체계 구축//은행·증권·금융 소송]]국내 주요 금융 기관들의 금융 분쟁 사건 대리//은행, 자산운용 등]]금융규제 일반 및 금융투자상품의 설정, 운용, 판매 규제 자문","한국어, 영어","PLC Private Equity and Venture Capital Multi-jurisdictional Guide 2014/15 - Venture Capital Country Q&A: “South Korea” section (공저, Thomson Reuters, 2014)",https://www.kimchang.com/ko/professionals/view/jaehong.park,-
김앤장,박정택,변호사,02-3703-1282 ,jtpark@kimchang.com,"김·장 법률사무소의 박정택 변호사는 1998년부터 인사·노무, ESG, M&A, 부패방지·준법경영, 외국인 투자 및 해외 투자, 개인정보보호 등 여러 분야에서 법률자문을 제공하고 있습니다. 박 변호사는 미국, 영국, 독일, 프랑스 등 구미 여러 나라뿐만 아니라 중국, 일본, 홍콩, 싱가포르, 호주 등 범태평양 아시아 지역 국가들, 그리고 사우디 아라비아, 아랍 에미레이트, 카타르, 오만 등 중동 지역에 이르기까지 다양한 글로벌 기업의 법률 자문을 담당합니다. 박 변호사는 독일 프랑크푸르트 소재 Schiedermaier Rechtsanwaelte 로펌에서 근무한 경험이 있습니다.박 변호사는 자문 업무와 연관되어 발생하는 각종 소송, 고용노동부 및 각 지청과 경찰, 검찰의 형사사건 등을 비롯하여 국가인권위원회에 제기된 사건들, 각급 노동위원회의 심판 및 조정 사건 등 각종 분쟁 사건해결에 있어서도 풍부한 경험을 가지고 있습니다. 그 외에도 단체교섭 등 노사관계에 대한 전반적인 자문과 노사협의회와 같은 협력적 노사관계와 관련된 자문, 국내기업 및 글로벌기업의 M&A, M&A 이후의 기업 통합 작업 (Post-Merger Integration) 및 기업의 구조개편과 회생 작업과 관련하여 풍부한 경험과 철저한 사실관계의 분석을 바탕으로 다양한 전략 개발 및 협상력을 발휘하여 고객들이 만족할 수 있는 결과로 이끌고 있습니다. 또한, ESG 그룹에서 ESG 이니셔티브, ESG 실사, ESG 시스템 구축 및 공급망 관리 등에 있어 선도적인 역할을 하고 있습니다.박 변호사는 다양한 국가와의 업무 수행 경험을 바탕으로 한국 소재 각국 대사관에 법률 자문을 활발히 수행하고 있습니다. 또한, 중·고등학생들의 멘토로서 활동하는 등 정기적인 재능 기부 활동 또한 수행하고 있습니다. 고용노동부에 자문을 제공하여 근로자퇴직급여보장법을 비롯한 국내 노동 관계법의 입법과 실무 주요 분야를 확립하고 발전시키는 데에도 기여하고 있습니다.박 변호사는 2014년부터 2019년까지 Chambers Asia-Pacific에서 6년 연속 한국의 인사·노무 부문 Leading Individual로 선정되었으며, Chambers Global 2013에서 기업인수·합병(독일) 부문 Leading Individual로 선정되었습니다. 2019년 이후로는 Who’s Who Legal에서 매년 Leading Lawyer로 선정되고 있습니다. 또한, 월간노동법률 등 법률 전문 간행물에도 활발히 기고하고 있습니다.박 변호사는 1993년 서울대학교 법과대학을 졸업하여 1995년 사법연수원을 24기로 수료하였으며, 2004년 Columbia Law School에서 석사학위(LL.M.)를 취득하였습니다.","인사·노무 +,해외법무,기업인수·합병 +,부패방지·준법경영,외국인투자,프라이버시·정보보호","파나마 공화국 명예영사 (2024-현재),공군법무관 (1995-1998),김·장 법률사무소 (1998-현재),Schiedermair Rechtsanwaelte 법률사무소, 독일 프랑크푸르트 (2004-2005)","서울대학교 (법학사, 1993),제34회 사법시험 합격 (1992),대법원 사법연수원 (24기, 1995),Columbia Law School (LL.M., 2004)","변호사, 대한민국 (1995)","Client Choice Awards - Labour & Employment (Lexology, 2022),Leading Lawyer, Lexology Index: Pensions & Benefits (Lexology Index, 2021-2022),Leading Lawyer, Lexology Index: Labour & Employment (Lexology Index, 2021-2022, 2025),Leading Lawyer, Lexology Index: Korea, Labour & Employment (Lexology Index, 2019-2023, 2025),Leading Individual, Chambers Asia-Pacific, Employment (Chambers and Partners, 2014-2019),Leading Individual, Chambers Global, Corporate/M&A (Germany) (Chambers and Partners, 2013)",,"유수의 다국적 금융, IT 및 해운회사들을 대리하여 다양한 구조조정 사건 자문,유수의 다국적 회사들의 해고 및/또는 징계 사건 자문 및 관련 분쟁 사건 대리,고용노동부의 HR 컴플라이언스 감사와 관련하여 유수의 다국적 기업들에 대한 법률 자문,유럽 및 중동 등 해외에 진출한 여러 국내 기업들의 인사·노무 전반에 대한 자문,금융, 자동차, 제약 산업 분야의 유수한 다국적 기업들을 대리하여 단체교섭 관련 자문,다국적 금융, IT 및 해운회사들 간 글로벌 합병 거래 또는 자산/영업 양수도 관련 자문,다국적 기업들의 직원 개인정보 사안 관련 자문 다국적 기업들의 직원 개인정보 사안 관련 자문,기업의 기술혁신에 따른 고용구조조정 관련 연속 프로젝트에서 외국계 반도체 기업을 성공적으로 대표,해외 급수업체 국내법인 2개사 합병 시 합병 후 통합사업 성공,글로벌 금융기관이 다른 금융기관과 글로벌 합병 및 노무 및 고용 측면에서 대상 회사의 한국 법인 중 한 곳을 폐쇄하는 사안 관련 자문","한국어, 영어, 독일어, 프랑스어, 	              	아랍어",,https://www.kimchang.com/ko/professionals/view/jtpark,-
김앤장,박준기,변호사,02-3703-1721 ,junki.park@kimchang.com,,"금융규제 및 컴플라이언스 +,부패방지·준법경영,기업형사·화이트칼라범죄,국제중재·소송","김·장 법률사무소 (2005-2018, 2023.7.-현재),한국화장품㈜ 감사 (2024.3.-현재),한국거래소 코스닥상장위원회 심의위원 (2022-2023),서울지방변호사회 ESG 특별위원회 위원 (2022-2024),법무법인 태평양 (2018-2023),법무부 해외진출 중소기업 법률자문단 자문위원 (2016-현재),Cleary Gottlieb Steen & Hamilton 뉴욕 (2013-2014),공군통역장교 (1997-2000),법무부 검찰사무관 (1996)","Columbia Law School (LL.M., 2013),대법원 사법연수원 (34기, 2005),제44회 사법시험 합격 (2002),Harvard College (B.A., 1995)","변호사, 대한민국 (2005)",,,,"한국어, 영어","Recent trends and issues in the Korean short sale regime (공저, IFLR, 2024),내부조사의 쟁점과 실무, BFL 제113호 (공저, 서울대학교 금융법센터, 2022.5.),Chambers Global Practice Guides - White Collar Crime: South Korea - Law & Practice (공저, Chambers and Partners, 2019-2022),소송 및 분쟁 해결을 위한 국제 비교 법률 가이드: 한국편 (공저, ICLG, 2009),한국 IFLR 가이드, 증권집단소송사건 (공저, IFLR, 2009),Practical Law Company, 국가간 분쟁해결 안내서 제1권: 한국편 (공저, PLC, 2008)",https://www.kimchang.com/ko/professionals/view/junki.park,-
