company,name,job,call,email,introduction,related_fields,career,education,eligibility,awards,assessment,performance,language,activity,url,new
김앤장,한찬식,변호사,02-3703-5797 ,chansik.han@kimchang.com,"김·장 법률사무소의 한찬식 변호사는 기업형사·화이트칼라범죄, 영업비밀·기업정보 보호, 중대재해 대응, 조세, 부패방지·준법경영 등 분야에서 법률자문을 제공하고 있습니다.한 변호사는 김·장 법률사무소 근무 이전, 27년 이상 검사로 재직하면서 다수의 대규모 기업 범죄 및 탈세, 영업비밀 유출 사범 수사 등을 통해 특별 수사 분야에서 전문 역량을 발휘해 왔으며, 중대재해 사건 대응, 디지털 압수수색 절차, 언론 공보 업무 등에도 정통하다는 평가를 받고 있습니다.","기업형사·화이트칼라범죄,영업비밀·기업정보 보호,중대재해 대응,조세 +,부패방지·준법경영,사이버 사고 대응 +","HD현대일렉트릭 사외이사 (2023-현재),김·장 법률사무소 (2022-현재),주식회사 풀무원 사외이사 (2022-현재),중부지방국세청 조세 법률 고문 (2020-2022),여수광양항만공사 법률 고문 (2020-2022),한화커넥트주식회사 법률 고문 (2020-2021),법무법인 아미쿠스 대표변호사 (2019-2022),서울동부지방검찰청 검사장 (2018-2019),수원지방검찰청 검사장 (2017-2018),울산지방검찰청 검사장 (2015-2017),서울고등검찰청 차장검사 (2015),법무부 인권국장 (2014-2015),수원지방검찰청 안양지청장 (2013-2014),서울고검 검사 (국가정보원 파견, 2011-2013),대검찰청 대변인 (2010-2011),서울중앙지방검찰청 첨단범죄수사제1부장검사 (2009-2010),서울중앙지방검찰청 총무부장검사 (2009),법무부 법조인력정책과장 (2007-2009),춘천지방검찰청 영월지청장 (2006-2007),울산지방검찰청 특수부장검사 (2005-2006),서울동부지방검찰청 부부장검사 (2004-2005),서울지방검찰청 동부지청 검사 (2003-2004),법무부 국제법무과 검사 (2000-2003),대구지방검찰청 검사 (1997-2000),수원지방검찰청 검사 (1995-1997),대구지방검찰청 경주지청 검사 (1994-1995),서울지방검찰청 검사 (1992-1994)","University of Pennsylvania Law School (LL.M., 1998),대법원 사법연수원 (21기, 1992),서울대학교 (법학사, 1990),제31회 사법시험 합격 (1989)","변호사, 대한민국 (1992)",황조근정훈장 (2017),,,"한국어, 영어","한일투자협정해설 (공저, 산업연구원, 2003)",https://www.kimchang.com/ko/professionals/view/chansik.han,-
김앤장,홍승희 (Cindy Seunghee HONG ),외국변호사,02-3703-5730 ,cindy.hong@kimchang.com,,"부패방지·준법경영,기업형사·화이트칼라범죄,공정거래 소송,기업인수·합병 +,소송 +","김·장 법률사무소 (2023-현재),CEO/Founder, Guillaumia LLC (2021-2023),Morgan Lewis & Bockius LLP (2016-2021),Steptoe & Johnson LLP (2013-2016)","American University Washington College of Law (J.D., cum laude, 2013),cum laude,Duke University (B.A., Political Science and Economics, 2007)","외국변호사, 워싱턴 D.C. (2014), 뉴욕주 (2014), 캘리포니아주 (2020)",,,,"한국어, 영어, 프랑스어","“Current Antitrust Law Trends and Issues for Technology Companies” 발표, Silicon Valley First Cup of Coffee Breakfast Briefing (Morgan Lewis Seminars, 2019),“US Supreme Court to Hear International Case Involving Alleged Price Fixing”, LawFlash of Morgan Lewis & Bockius LLP (공저, 2018),“’특허괴물’에 대한 미국 정부의 규제 동향”, 글로벌 경쟁 리포트, 경쟁저널 제183호 (공저, 2015),“광고와 기사, 그 경계선은?”, 글로벌 경쟁 리포트, 경쟁저널 제182호 (공저, 2015),“미국에서의 기업결합 절차 및 최근 심사 동향 (US Merger Enforcement Procedure)”, 글로벌 경쟁 리포트, 경쟁저널 제181호 (2015)",https://www.kimchang.com/ko/professionals/view/cindy.hong,-
김앤장,홍용화,변호사,02-3703-1415 ,yonghwa.hong@kimchang.com,"김·장 법률사무소의 홍용화 변호사는 기업형사, 부패방지·준법경영, 해외법무 분야의 변호사로서 기업경영과 관련된 다양한 소송, 법률자문 및 컴플라이언스 업무를 담당하고 있습니다. 또한 관세형사, 중대재해 대응, 환경, 개인정보 및 사이버범죄에 관한 전문적인 법률 서비스를 제공하고 있습니다.홍 변호사는 김·장 법률사무소에 근무하기 전 18년간 검찰에서 재직하였습니다. 재직 기간 중 대검찰청 국제협력담당관, 서울중앙지방검찰청 국제범죄수사부장 및 첨단범죄수사부 검사, 의정부지방검찰청 공공수사·특별수사부장, 부산지방검찰청 공판부장 등으로 근무하면서 초국경범죄, 특수, 중대재해, 관세 수사 및 공소 수행을 두루 경험하였습니다.홍 변호사는 검사 재직 중 2년간 World Bank(미국 워싱턴DC)에 파견되어 사이버범죄 대응, 범죄수익환수 관련 프로젝트를 수행하였고, 또한 재정경제부에서 근무하면서 한-EU, 한-ASEAN, 한-캐나다, 한-인도, 한-GCC(중동 걸프협력회의) FTA 협상시 한국 정부 대표단으로 참석하여 협상한 이력이 있습니다.홍 변호사는 대검찰청으로부터 국제형사 분야 전문검사로 공인인증을 받았습니다.","기업형사·화이트칼라범죄,부패방지·준법경영,관세 및 국제통상 +,중대재해 대응,사이버 사고 대응,환경","김·장 법률사무소 (2026.3.-현재),인천지방검찰청 부천지청 차장검사 (2025-2026),서울중앙지방검찰청 국제범죄수사부장 (2024-2025),대검찰청 국제협력담당관 (2023-2024),의정부지방검찰청 형사제4부장(공공수사·특별수사부장) (2022-2023),부산지방검찰청 공판제2부장 (2021-2022),서울중앙지방검찰청 부부장검사 (2020-2021),월드뱅크 법률정책국 및 부패자산회복기구 선임법률자문관 (2018-2020),광주지방검찰청 검사 (2018),서울중앙지방검찰청 검사 (2015-2017),수원지방검찰청 검사 (2013-2014),창원지방검찰청 진주지청 검사 (2010-2012),광주지방검찰청 순천지청 검사 (2008.8.-2010),기획재정부 통상조정과 행정사무관 (2008),재정경제부 국제경제과 행정사무관 (2006-2008)","University of Illinois, College of Law (LL.M., 2012),대법원 사법연수원 (35기, 2006),제45회 사법시험 합격 (2003),고려대학교 (학사, 경영학, 2001)","변호사, 대한민국 (2006)","공인전문검사, 국제형사 분야 (블루벨트) (대검찰청, 2025),경제검사상 (매일경제신문, 2017),검찰총장 표창 (검찰업무유공, 2017),환경부장관 표창 (제작자동차 배출가스 업무유공, 2017)",,,"한국어, 영어",,https://www.kimchang.com/ko/professionals/view/yonghwa.hong,-
김앤장,홍유석 (Shane Y. Hong),외국변호사,02-3703-4502 ,shane.hong@kimchang.com,,"기업인수·합병 +,부패방지·준법경영,공정거래,프라이버시·정보보호,인사·노무","김·장 법률사무소 (2014-현재),오라클 코리아 대표이사 (2009-2014),(주)픽셀플러스 사내변호사 (2006-2009),법무법인 세종 (2003-2005),법무법인 케이씨엘 (2001-2003),법무법인 태평양 (1999-2001)","Santa Clara University School of Law (J.D., 1999),University of California, San Diego, Graduate School of International Relations an Pacific Studies (Masters of Pacific International Affairs, 1994),University of California at Los Angeles (B.A., Economics and International Area Studies, 1991)","외국변호사, 워싱턴 D.C. (2000)",,,"Database Software, Firm Middleware, and Applications Licensing and Consulting Transactions]]Spearheaded and closed a Consulting Services Agreement with a leading Korean commercial airline in connection with its Consulting Services Project.,Negotiated a Master Agreement with a major science and technology institute of the Korean government in connection its Advanced Generation Supercomputer Project.,Led and closed License and Services Agreement with a leading telecommunications company of Korea.,Negotiated and closed Master Software License and Consulting Agreement with a leading Chaebol IT company of Korea.,Managed and closed Unlimited License Agreement with leading Chaebol IT company of Korea.","한국어, 영어","Negotiating and Drafting Software Consulting Agreements (Raymond L. Ocampo Jr., Shelley S. Curtis, and John J. Moss, 1996.4.)",https://www.kimchang.com/ko/professionals/view/shane.hong,-
김앤장,홍지용 (Johnny Ji Yong HONG),외국변호사,02-3703-1970  ,jiyong.hong@kimchang.com,,"인사·노무,인사·노무 소송,부패방지·준법경영,기업인수·합병 +,프라이버시·정보보호",김·장 법률사무소 (2019-현재),"Duke University School of Law (J.D., 2019),Cornell University (B.A., 2014)","외국변호사, 뉴욕주 (2020)",,,,"한국어, 영어",,https://www.kimchang.com/ko/professionals/view/jiyong.hong,-
김앤장,홍지혜,변호사,+65-6976-3046 ,jihye.hong@kimchang.com,"김·장 법률사무소의 홍지혜 변호사는 제약·의료기기·식품·화장품, 공정거래, 부패방지·준법경영, 기업인수·합병 등 폭 넓은 법률자문 서비스를 제공하고 있습니다.특히, 제약, 의료기기, 식품, 화장품을 포함한 보건의료산업 분야에 대한 풍부한 자문 경험을 바탕으로, 주로 해당 산업 분야의 고객사들을 위하여 보건의료 관련 규제, 공정거래 및 대리점 관계, 부패방지법령, 인수·합병 등 다양한 법률자문을 제공하여 왔습니다.또한, 홍 변호사는 공정거래 분야에서 업종을 불문하고 시장지배적 지위남용행위, 불공정거래행위, 부당지원행위 조사 대응 및 자문을 제공하고 있으며 국내 및 해외 기업결합심사 등 관련 업무 또한 꾸준히 수행하고 있습니다.","제약·의료기기·식품·화장품,공정거래,부패방지·준법경영,기업인수·합병 +,싱가포르","김·장 법률사무소 싱가포르 오피스 (2025-현재),김·장 법률사무소 (2017-현재)","제6회 변호사시험 합격 (2017),서울대학교 법학전문대학원 (법학전문석사, 2017),서울대학교 (경영학사, 2014)","변호사, 대한민국 (2017)","Leading Lawyer, Lexology Index: Korea, Competition (Lexology Index, 2024-2025),Stand-out Lawyer - Independently Rated Lawyers (Thomson Reuters, 2024-2025)",,"제약·의료기기·식품·화장품]]제약·의료기기 회사 sales/marketing/promotional practice 관련 자문,제약·의료기기 회사 third party audit 시행,제약·의료기기 회사 compliance system 및 SOP 구축 관련 자문,제약·의료기기 회사 기업구조조정·영업양수도 관련 자문,약사법, 의료기기법, 식품위생법 위반 행정처분 대응,공정거래위원회 부당고객유인행위(불법리베이트) 조사 대응,제약·의료기기·식품·화장품 회사의 표시·광고 관련 자문,제약·의료기기·식품·화장품 회사 인수 관련 자문//공정거래]]생명과학·생물의약품 공정분야의 다국적 회사들 간 기업결합 자문,수직적 제한행위·선택적 유통행위 관련 조사대응 및 자문,글로벌 TMT·IT회사의 불공정거래행위 건 대리,전기통신·반도체 분야의 시장지배적지위 남용행위 관련 자문,국내 그룹 반독점 컴플라이언스 시스템 구축 및 자문,국내 그룹 내부거래 컴플라이언스 시스템 구축 및 자문,국내 건설사의 공동수급체 구성 등을 통한 부당지원 건 대리,하도급법 관련 공정위, 중기부 조사 대리 및 관련 자문,각종 산업분야에서의 기업결합신고 관련 자문 및 대리","한국어, 영어","Chambers Global Practice Guides - Medical Devices & Consumer Health Products 2022: Korea Chapter (공저, Chambers and Partners, 2022)",https://www.kimchang.com/ko/professionals/view/jihye.hong,-
김앤장,황희철,변호사,02-3703-1107 ,heechul.hwang@kimchang.com,"황희철 변호사는 국제형사, 관세 및 국제통상, 기업형사, 부패방지 및 준법경영 관련 자문을 담당하고 있으며, 특히, 국내외의 준법경영에 관한 많은 경험과 역량을 쌓아왔습니다. 황 변호사는 많은 해외 뇌물, 해외 조세 및 관세, 국제통상, 자금세탁, 미국 세재법 위반 관련법률 등에 대한 여러 가지 사건을 성공적으로 처리해 왔습니다.25년 동안 검사로서 근무하면서 많은 중요 기업 사건을 처리했고, 검찰은 물론 경찰, 특별사법경찰의 수사 관행과 압수수색을 비롯한 여러 가지 형사절차에 관해서도 해박한 지식을 가지고 있습니다. 황 변호사는 법무부와 대검찰청에서 다양한 직위를 두루 거쳐 이민, 교정, 가석방과 사면 업무처리에도 정통하다는 평가를 받고 있습니다.황 변호사는 군 복무를 마치고 1986년에 검사로 임관하여 광주지검, 진주지청, 서울지검에서 근무 하였으며 이후 법무부 국제법무심의관실, 서울고검을 거쳐 1995년부터 1997년까지 사법연수원 교수를 역임하였습니다. 그 후 대검찰청 정보과장, 범죄정보 제1담당관을 역임, 1998년부터 1999년까지 부산지검 특수부장을 역임하였습니다. 황 변호사는 대검찰청 정보과장으로 근무하는 동안 한국정보법학회 설립을 주도하였고 1998년에는 WTO 분쟁해결 패널로 등재되기도 하였습니다.황 변호사는 1999년에 다시 대검찰청에 복귀하여 범죄정보 제1담당관을 역임하고 법무부에서 검찰의 인사 조직 예산을 담당하는 검찰 제1과장으로 근무하였으며, 이후 평택지청장, 울산지검 차장검사, 법무부 정책기획단장을 거쳐 2005년부터 2006년까지 서울지검 제1차장검사로 근무하였습니다. 2006년 검사장 승진 후 법무부 기획관리실장, 대구고검 차장검사, 대검찰청 공판송무부장을 역임하였으며, 광주지방검찰청 검사장, 서울 남부지방검찰청 검사장을 거쳐 2009년 8월 제53대 법무부 차관으로 임명되었습니다. 2년 동안의 근무 뒤 2011년 8월 11일 차관 직을 퇴임하고 2011년 11월 1일 김·장 법률사무소에 합류하였습니다.황 변호사는 대검찰청 공판송무부장으로 근무하며 대법원 제2기 양형위원을 역임한 바 있으며, 차관 직에 있으면서 공직위원회 위원, 가석방위원회 위원장, 치료감호위원회 위원장, 사면위원회 부위원장을 역임하였습니다.황희철 변호사는 김·장 법률사무소에 합류한 후 특별수사, 국제형사, 국제 제재, 영업비밀 및 지식재산권 관련 형사, 관세, 출입국, 교정 분야에서 다양한 사건들을 성공적으로 수행하였으며, 2019.4.19. 부터 2021.4.18. 까지는 대한변호사협회 법률구조재단 이사장을 역임하면서 공익봉사 활동을 하기도 했습니다. 황 변호사는 현재 (주) 풍산의 사외이사로 활동하고 있습니다.황 변호사는 다방면의 외국어를 구사하고 특히 영어, 중국어, 일본어에 능통하며 반도체 산업 전반에 대해 해박한 지식을 가지고 있어, 반도체 산업 관련 업체들에 대한 다양한 서비스를 제공하고 있습니다.","지식재산권 분쟁,부패방지·준법경영,프라이버시·정보보호,기업형사·화이트칼라범죄,대북 협력 및 투자,지식재산권 +,게임·리조트·엔터테인먼트,기업지배구조·경영권분쟁 +","대한변호사협회 법률구조재단 이사장 (2019.4.-2021.4.),김·장 법률사무소 (2011.11.-현재),공직자윤리위원회 위원 (2009.8.-2011.8.),법무부 사면위원회 부위원장 (2009.8.-2011.8.),치료감호심의위원회 위원장 (2009.8.-2011.8.),가석방심사위원회 위원장 (2009.8.-2011.8.),제53대 법무부 차관 (2009.8.-2011.8.),서울남부지방검찰청 검사장 (2009.1.-2009.8.),광주지방검찰청 검사장 (2008.3.-2009.1.),대법원 제2기 양형위원회 위원 (2007.3.-2008.3.),대검찰청 공판송무부장 (2007.3.-2008.3.),대구고등검찰청 차장검사 (2006.3.-2007.3.),법무부 정책홍보관리실장 (2006.2.-2006.3.),서울중앙지방검찰청 제1차장검사 (2005.4.-2006.2.),법무부 정책기획단장 (2004.6.-2005.4.),울산지방검찰청 차장검사 (2003.4.-2004.6.),수원지방검찰청 평택지청장 (2002.2.-2003.3.),법무부 검찰1과장 (2001.6.-2002.2.),대검찰청 범죄정보 제1담당관 (2000.1.-2001.6.),대검찰청 범죄정보 제2담당관 (1999.6.-2000.1.),부산지방검찰청 특별수사부장 (1998.8.-1999.6.),대검찰청 정보화담당관 (1997.3.-1998.8.),세계무역기구(WTO) 분쟁조정위원(Panelist) (1995.10.-1997.9.),사법연수원 교수 (1995.3.-1997.2.),서울고등검찰청 검사 (1994.9.-1995.2.),법무부 국제법무심의관실 검사 (1992.3.-1994.9.),서울지방검찰청 검사 (형사5부, 조사부) (1990.3.-1992.3.),마산지방경찰청 진주지청 검사 (1988.9.-1990.3.),광주지방검찰청 검사 (특수부) (1986.9.-1988.8.),육군법무관 (1983.8.-1986.8.)","서울대학교 경영대학 최고경영자과정 (AMP 64기, 2007),KAIST 테크노경영대학원 최고정보경영자과정 (AIM 12기, 2000),Harvard University, Kennedy School of Government Negotiation Project (1994),서울대학교 사법발전연구과정 (7기, 1992),University of Michigan Law School (LL.M., 1991),대법원 사법연수원 (13기, 1983),제23회 사법시험 합격 (1981),서울대학교 법과대학원 (석사과정, 1981),서울대학교 법과대학 (법학사, 1981)","변호사, 대한민국 (1983)","Leading Lawyer, Lexology Index: Korea, Labour & Employment (Lexology Index, 2025),Leading Lawyer, Lexology Index: Labour & Employment (Lexology Index, 2025),황조근정훈장 (2012.6.30),법의 날 유공 국무총리 표창 (1991)",,"캐나다 철도 항공 산업 업체, 특수 수사 자문,한국 은행, 미국 제재법 위반 사건 수사 자문,독일 자동차 부품업체, 조세 형사 사건 자문,한국 잉크 제조업체, 품목분류 관련 형사 사건 자문,한국 다수 제약업체, 리베이트 관련 형사사건 자문,한국 스마트폰 액정유리 납품업체, 관세 형사 사건 자문,한국 다수 선박 업체 및 조선 회사, 외환 재산도피 및 관세 형사사건 자문,다수 한국 기업, 특수 수사 사건 자문,미국 반도체 부품회사, 영업비밀 형사 사건 자문,한국 디스플레이 제조사, 영업비밀 형사 사건 자문,미국 소프트웨어 회사, 영업비밀 형사 사건 자문,한국 통신사, 프라이버시 관련 형사 사건 자문,한국 무역관련 기관, 프라이버시 관련 형사 사건 자문,한국 방위산업업체, 형사 사건 자문,미국 IT 기업, 국회 불출석 형사 사건 자문,기타 다수 클라이언트, 국적, 교정, 가석방 및 사면 관련 자문","한국어, 영어, 일본어, 중국어, 독일어","영업비밀 관련 기조 연설 (BOE, 북경, 2014.1.),Medium과 저작권, 정보법학 창간호 (1997) 등 약 20편,국제지적재산권법 (공저, 육법사, 1995),UR협정의 법적고찰 상/하 (공저, 법무부, 1994)",https://www.kimchang.com/ko/professionals/view/heechul.hwang,-
김앤장,강규민,변호사,02-3703-4807 ,gyumin.kang@kimchang.com,"김·장 법률사무소의 강규민 변호사는 부동산·건설, 외국인투자, 건설·부동산 분쟁, 사모투자 및 자산운용 등의 분야에서 법률 자문을 제공하고 있습니다.강 변호사는 특히 국내외 투자자들의 상업용 부동산 거래, 개발, 기타 투자 프로젝트 자문을 성공적으로 수행하며 다양하고 풍부한 경험을 쌓아왔습니다.","부동산,외국인투자,건설·부동산 분쟁,사모투자,자산운용","김·장 법률사무소 (2016-현재),LG전자 LG전자기술원 소자재료연구소 주임연구원 (2009-2012)","제5회 변호사시험 합격 (2016),성균관대학교 법학전문대학원 (법학전문석사, 2016),한국과학기술원(KAIST) (공학석사, 바이오및뇌공학, 2009),한국과학기술원(KAIST) (학사, 바이오및뇌공학, 2007)","변호사, 대한민국 (2016)",,,"부동산 거래]]서울, 대구, 대전 소재 대형마트 건물 취득 자문,국내 부동산펀드의 스코틀랜드 글래스고 소재 오피스 빌딩 취득 자문,해외 투자자의 부동산펀드를 통한 경기도 이천시 소재 물류창고 취득 자문,해외 투자자의 부동산펀드를 통한 서울 삼성동 소재 오피스 빌딩 취득 자문,인천 송도 소재 복합쇼핑몰 매각 자문,해외 투자자의 서울 익선동 소재 호텔을 보유한 부동산펀드 수익증권 취득 자문,해외 투자자의 부동산펀드를 통한 서울 서교동 소재 오피스 빌딩 취득 자문,서울 논현동 소재 공동주택 개발사업 부지 매각 자문,해외 투자자의 경기도 용인시 소재 물류시설을 보유한 부동산펀드 수익증권 취득 자문,국내 기업의 경기도 용인시 소재 토지 취득 자문,PFV(Project Financing Vehicle)의 서울 서초동 소재 오피스텔 개발사업 부지 매각 자문,해외 투자자의 부동산펀드를 통한 서울 동대문 소재 호텔 취득 자문,리츠의 경기도 용인시 소재 지식산업센터 선매입 자문,경기도 용인 소재시 디자인센터 취득 자문,해외 투자자의 부동산펀드를 통한 강원도 춘천시 소재 골프장 취득 자문,서울 여의도 소재 금융회사 사옥 취득 자문,충청남도 천안시 소재 공장 취득 자문,해외 투자자의 부동산펀드를 통한 서울 상암동 소재 데이터센터 부지 취득 자문,해외 투자자의 부동산펀드를 통한 경기도 오산시 소재 물류센터 취득 자문,해외 투자자의 부동산펀드를 통한 경기도 평택시 소재 물류센터 취득 자문,증권회사의 여의도 사옥 매각 후 재임차 거래 자문,서울 남대문로 소재 오피스 빌딩 매각 자문,서울 방이동 소재 오피스 빌딩을 보유한 부동산펀드 수익증권 매각 자문,부동산펀드의 서울 신림동 소재 리테일 건물 매각 자문,논현동 소재 오피스 빌딩을 보유한 부동산펀드 수익증권 취득 자문,해외 투자자의 부동산펀드를 통한 서울 성수동 소재 오피스 빌딩 선매입 거래 자문,해외 투자자의 부동산펀드를 통한 경기도 여주시 소재 물류센터 취득 자문,해외 투자자의 부동산펀드를 통한 제주도 소재 호텔 취득 자문,해외 투자자의 부동산펀드를 통한 경상남도 양산시 소재 물류센터 선매입 거래 자문,경기도 평택시 소재 물류센터 매각 자문,해외 투자자의 부동산펀드를 통한 경기도 인천시 소재 물류센터 선매입 거래 자문,경기도 용인시 소재 물류센터 취득 자문,경기도 고양시 소재 물류창고 선매입 거래 자문,경상남도 김해시 대형마트 개발 부지 취득 자문,해외 투자자의 부동산펀드를 통한 충청북도 보은군 소재 골프장 부동산 취득 자문,해외 투자자의 부동산펀드를 통한 서울 서초동 소재 오피스 빌딩 취득 자문,해외 투자자의 부동산펀드를 통한 경기도 이천시 소재 물류센터 선매입 거래 자문,해외 투자자의 부동산펀드를 통한 경기도 광주시 소재 물류센터 선매입 거래 자문//부동산 개발]]서울 명동 소재 오피스 빌딩 취득 및 호텔/판매시설 개발 자문,경기도 고양시 소재 데이터센터 부지 취득 및 개발 프로젝트 자문,경기도 안성시 소재 물류센터 부지 취득 및 개발 프로젝트 자문,경기도 화성시 소재 물류센터 부지 취득 및 개발 프로젝트 자문,경기도 이천시 소재 물류센터 부지 취득 및 개발 프로젝트 자문,울산 소재 기업형 임대주택 리츠 프로젝트 자문,서울 성북구 소재 청년임대주택 리츠 프로젝트 자문,경기도 파주시 소재 기업형 임대주택 리츠 프로젝트 자문,경기도 화성시 소재 기업형 임대주택 리츠 프로젝트 자문,베트남 하노이 소재 복합시설 개발 프로젝트 자문","한국어, 영어","Surface-modified microelectrode array with flake nanostructure for neural recording and stimulation (공저, Nanotechnology, 2010),Generation of patterned neuronal networks on cell-repellant poly(oligo(ethylene glycol) methacrylate) films (공저, Chem Asian J, 2010),Pitch-dependent acceleration of neurite outgrowth on nanostructured anodized aluminum oxide substrates (공저, Angew Chem Int Ed Engl, 2010),Direct rapid prototyping of PDMS from a photomask film for micropatterning of biomolecules and cells (공저, Lab Chip, 2009),Agarose microwell based neuronal micro-circuit arrays on microelectrode arrays for high throughput drug testing (공저, Lab Chip, 2009),“μ-Neuronal cluster array for high throughput functional assay”, 한국바이오칩학회 춘계학술대회 ((사)한국바이오칩학회, 2008)",https://www.kimchang.com/ko/professionals/view/gyumin.kang,-
