company,name,job,call,email,introduction,related_fields,career,education,eligibility,awards,assessment,performance,language,activity,url,new
김앤장,최병민,변호사,02-3703-1742 ,byungmin.choi@kimchang.com,"김·장 법률사무소의 최병민 변호사는 보험, 기업인수·합병, 사모투자 및 외국인투자 등의 기업법무 분야에서 법률 자문을 제공하고 있습니다.최 변호사는 다양한 국내외 기업 및 사모투자 전문회사들의 주요 cross-border, 국내 인수·합병 및 합작투자 거래들을 성공적으로 수행한 경험이 풍부합니다. 정교하고 복잡한 다양한 인수·합병 업무에 따르는 거래구조 자문, 계약서 작성, 협상 및 실행 업무를 담당하면서 축적된 경험과 지식에 기초하여 최 변호사는 국내외 유수의 사모투자 전문회사 및 다양한 전략적 투자자 등 주요 고객사들의 수요와 필요를 충족하는 법률 자문을 제공하여 왔습니다.뿐만 아니라 최 변호사는 보험 그룹의 일원으로서 보험사의 설립, 인수·합병, 라이선스 신청, 감독당국의 검사 대응 및 보험금 청구/방어와 같은 보험보상 등 보험규제 및 보험계약관계에 대한 풍부한 자문 경험을 보유하고 있습니다.이처럼 국내외 주요 고객들의 각종 거래, 규제 및 조사 사건을 대리하면서 축적된 다양하고 폭넓은 경험에 기초하여, 최 변호사는 기업지배구조, 민·형사 송무 등 여러 분야의 업무들이 망라적으로 관련된 복잡한 기업분쟁사건을 종합적으로 관리하고 조율한 경험도 갖추고 있습니다.최 변호사는 대한민국 및 캘리포니아주 변호사 자격을 보유하고 있습니다.","기업인수·합병 +,사모투자,보험,보험 소송,M&A 및 기업지배구조 소송",김·장 법률사무소 (2009-현재),"University of San Diego School of Law (Visiting Scholar, 2016),고려대학교 법과대학원 (석사과정 수료, 2012),대법원 사법연수원 (38기, 2009),고려대학교 (법학사, 2007),제47회 사법시험 합격 (2005)","변호사, 대한민국 (2009); 캘리포니아주 (2017)","40 under 40 in Asia (Asian Legal Business, 2022),Young Lawyer of the Year, ALB Korea Law Awards (ALB, 2020),사법연수원장상 (사법연수원, 2009)",,"인수·합병]]국내 사모투자펀드의 의료기기사업부 인수 자문,국내 사모투자펀드의 국내 제조회사 매각 자문,국내 대기업의 보안전문회사 매각 자문,국내 사모투자펀드의 국내 유리제조회사 매각 자문,국내 대기업의 계열 보험회사 지분 인수 자문,국내 언론회사의 전환사채 발행 자문,글로벌 방산회사의 국내 소프트웨어회사 인수 자문,글로벌 보험회사의 국내 보험회사 매각 자문,글로벌 사모투자펀드의 국내 제약회사 매각 자문,국내 금융회사의 계열 금융회사 지분 인수 자문,국내 보험회사의 국내 핀테크회사 지분 인수 자문,국내 교육회사의 미국 교육회사 매각 자문,글로벌 사모투자펀드의 미국 식품회사 지분 매각 자문,국내 사모투자펀드의 국내 도시가스회사 매각 자문,글로벌 사모투자펀드의 국내 인터넷은행 지분 인수 자문,국내 제약회사의 계열사 합병 자문,국내 대기업의 계열사 합병 자문,국내 제약회사의 국내 의료기기 회사 지분 인수 자문,국내 금융지주회사의 국내 보험회사 인수 자문,글로벌 사모투자펀드의 국내 교육회사 인수 자문,국내 사모투자펀드의 국내 반도체장비 제조회사 인수 자문,국내 IT 대기업의 소프트웨어개발회사 인수 자문,국내 사모투자펀드의 국내 유리제품 제조회사 인수 자문,글로벌 벤처캐피털의 온라인 패션 플랫폼 소수 지분 투자 자문,글로벌 사모투자펀드의 국내 캐피털회사 및 저축은행 매각 자문,국내 사모투자펀드의 국내 보험사 매각 자문,국내 대기업의 국내 보안서비스 전문회사 매각 자문,국내 사모투자펀드의 국내 2개 도시가스회사 인수 자문,아시아계 사모투자펀드의 국내 화장품 제조업체 소수 지분 투자 자문,유럽계 보험사의 국내 손해보험중개회사 주식매매거래 자문,국내 사모투자펀드의 국내 자산운용사 인수 자문,글로벌 벤처캐피털의 국내 핀테크 회사 소수 지분 투자 자문,글로벌 사모투자펀드의 제약 및 의료기기 회사 인수 자문,글로벌 사모투자펀드의 국내 캐피털회사 주식 인수 자문,글로벌 프랜차이즈 회사의 물적 분할 후 영업양도 자문,글로벌 사모투자펀드의 국내 건설사 소수 지분 투자 자문,국내 금융지주사의 지방은행 인수 자문,국내 저축은행의 계열사 간 합병 자문,글로벌 생명과학 기업의 국내 제조업체 자산 인수 자문,글로벌 보험 그룹의 국내 손해보험사 인수 및 매각 자문,국내캐피털사의 타 캐피털사 인수 및 합병 자문,글로벌 사모투자펀드의 국내 보험회사 소수 지분 투자 자문//보험]]글로벌 보험회사의 국내 보험 및 재보험 규제 리서치 자문,글로벌 보험회사의 국내 보험중개사 매각 자문,국내 보험회사의 글로벌 서비스회사와의 사업협력계약 관련 자문,글로벌 보험회사의 국경간 보험계약에 관한 규제 관련 자문,글로벌 서비스회사의 상품에 대한 보험상품 해당 여부 관련 자문,국내 법인보험대리점의 지배구조 관련 자문,국내 법인보험대리점의 영업양수도 관련 분쟁 자문,글로벌 의료기기회사의 국내 보험회사와의 사업제휴 관련 자문,국내 보험회사의 국내PEF 투자 관련 자문,국내 플랫폼회사의 보험 모집 규제 관련 자문,국내 보험회사의 GA자회사 설립 자문,국내 유통회사의 아울렛 화재사고 관련 보험금 청구 자문,국내 물류회사의 물류센터 화재사고 관련 보험금 청구 자문,국내 화학회사의 공장폭발사고 관련 보험금 청구 자문,국내 생명보험사의 정관 및 내부 규정 관련 자문,국내 재보험사의 해외 영업채널 구축 관련 자문,국내 손해보험자의 전환우선주식인수의 규제 관련 자문,국내 생명보험사의 전 CFO에 대한 금융감독원의 제재처분 취소소송 자문,국내 생명보험사의 즉시연금 관련 소송 자문,국내 제조회사의 공장 화재사고 관련 보험금청구 자문,국내 손해보험사의 RG보험금청구소송 자문,글로벌 보험사의 국내 보험사 대주주변경승인 자문,글로벌 의료 및 보안 지원 전문 기업의 보험업법위반 형사사건 자문,외국계 보험사 한국지점의 D&O보험금 지급 관련 자문,국내 손해보험사의 개인정보보호법위반 형사사건 자문,그 외 다수 국내 보험회사들의 금융감독원 검사 대응 관련 자문,신용보험중개회사 및 손해보험중개회사 설립 자문,다수의 생명보험협회 및 손해보험협회의 보험 규제 관련 자문,글로벌 보험사의 국내 보증보험인허가 자문//소송 및 조사]]전문가배상책임보험에 관한 보험금 청구소송 자문,유사수신행위의 규제에 관한 법률위반 형사소송 자문,글로벌 제조회사의 국내 피투자기업에 대한 회계장부 열람·등사 신청사건 자문,국내 저축은행에 대한 주주의 주식매수청구사건 자문,증권사에 대한 약정금 지급청구소송 및 증권사에 대한 회사채 투자자의 손해배상청구소송 자문,국내 제조회사에 대한 공정거래위원회의 부당지원행위 금지 위반 관련 조사 자문,ELS 투자자의 글로벌 증권사에 대한 손해배상청구소송 자문,국내외 은행에 대한 통화옵션(KIKO) 관련 손해배상 청구소송 자문","한국어, 영어","Practical Law - Insurance and Reinsurance in South Korea: Overview (공저, Thomson Reuters, 2023, 2025),임원배상책임보험의 주요 내용 및 쟁점, BFL 제105호 (공저, 서울대학교 금융법센터, 2021.1.)",https://www.kimchang.com/ko/professionals/view/byungmin.choi,-
김앤장,최보규,변호사,02-3703-4798 ,bokyu.choe@kimchang.com,,"기업인수·합병 +,사모투자,기업지배구조·경영권분쟁 +,외국인투자,프라이버시·정보보호","김·장 법률사무소 (2019-현재),Kirkland & Ellis LLP, 뉴욕 (2024.9.-2025.9.),대한법률구조공단 (2018-2019),대검찰청 (2016-2018),공익법무관 (2016-2019)","제5회 변호사시험 합격 (2016),서울대학교 법학전문대학원 (법학전문석사, 2016),연세대학교 (이학사, 물리학 및 경제학, 2013)","변호사, 대한민국 (2016)",,,,"한국어, 영어, 중국어",,https://www.kimchang.com/ko/professionals/view/bokyu.choe,-
김앤장,최성욱,공인회계사,02-3703-8272 ,seonguk.choi@kimchang.com,"김·장 법률사무소의 최성욱 회계사는 기업인수·합병, 파이낸싱, 프로젝트 파이낸스, 사모투자 분야에서 자문을 제공합니다.최 회계사는 삼일회계법인에서 근무하며 국내외 기업의 M&A Transaction 관련 다양한 자문 업무를 수행하였습니다.","기업인수·합병 +,파이낸싱 +,프로젝트 파이낸스,사모투자","김·장 법률사무소 (2022-현재),삼일회계법인 (2015-2022)","성균관대학교 (경영학사, 2016),제50회 공인회계사 시험 합격 (2015)","공인회계사, 대한민국 (2016)",,,"국내 대기업 플라스틱 창호 제조 업체 사업부 매각 관련 자문,국내 대기업 컴퓨터시스템통합자문 업체 지분 매각 관련 자문,국내 대형 사모펀드의 온라인 플랫폼 업체 지분 투자 관련 자문,국내 대기업의 우즈베키스탄 소재 면방 법인 투자 관련 사업 타당성 검토,국내 케이블카 운영 관련 현금 흐름 및 투자금 상환 가능성 검토,기타 국내외 다양한 투자 및 인수 및 매각 관련 자문","한국어, 영어",,https://www.kimchang.com/ko/professionals/view/seonguk.choi,-
김앤장,최일해,변호사,02-3703-1989 ,ilhae.choi@kimchang.com,"김·장 법률사무소의 최일해 변호사는 부동산·건설 그룹 소속 변호사로서 주로 부동산 매매, 프로젝트 파이낸스, 해외직접투자 등 다양한 종류의 거래와 관련한 기업일반 및 금융 관련 법률자문을 수행하고 있습니다.또한, 기업 인수·합병 및 집합투자기구를 활용한 투자를 자문한 풍부한 경험을 보유하고 있으며, 부동산 개발, zoning 이슈, 각종 부동산 및 건축 관련 인허가 업무에 대해서도 자문하고 있습니다.","부동산,기업인수·합병 +,외국인투자,파이낸싱 +,프로젝트 파이낸스,사모투자,게임·리조트·엔터테인먼트","법무부 국제법무과 해외진출 중소기업 법률자문단 위원 (2016-현재),김·장 법률사무소 (2012-현재),육군법무관 (2009-2012)","대법원 사법연수원 (38기, 2009),고려대학교 (법학사, 2007),제48회 사법시험 합격 (2006)","변호사, 대한민국 (2009)",,,"국내 부동산 거래]]미국 국적 기업의 경기도 R&D 센터 선매입 자문,미국 국적 투자회사의 경기 이천 물류센터 선매입 자문,미국 국적 투자회사의 서울 강남구 상가 건물 매입 자문,미국 국적 기업의 경기 안성시 산업단지 내 공장 매각 자문,미국 국적 은행의 서울 중구 업무시설 매각 및 재임대 자문,서울 중구 업무시설을 매입하는 부동산펀드에 대한 국민연금기금의 지분투자 자문,국내 부동산펀드의 서울 및 부산 업무시설 매각 자문,스페인 국적 기업의 서울 강남구 상가 건물 매입 자문,스페인 국적 기업의 서울 명동 상가 건물 소유 회사 100% 지분 매입 자문,국내 카지노 기업의 제주 소재 카지노 영업장 영업 양수 자문,싱가포르 투자자의 경기 이천 물류센터 선매입 자문,미국 국적 보험사의 서울 중구 업무시설 매입 자문//국내 부동산 개발사업]]미국 국적 투자회사의 부동산펀드를 통한 경기 이천 물류센터 개발사업 투자 자문,중국 국적 투자회사의 합작투자회사를 통한 제주투자진흥지구 내 복합리조트 개발사업 투자 자문,미국 국적 기업의 합작투자회사를 통한 인천자유무역지구 내 복합 리조트 개발사업 투자 자문//해외 부동산 거래]]국내 부동산 펀드의 미국 시애틀 업무시설 매각 자문,국내 부동산 펀드의 독일 프랑크푸르트 업무시설 매입 자문,국내 부동산 펀드의 미국 시애틀 업무시설 매입 자문,국내 투자회사의 독일 소재 업무시설 50% 지분에 대한 매각 자문","한국어, 영어",,https://www.kimchang.com/ko/professionals/view/ilhae.choi,-
김앤장,최임정,공인회계사,02-3703-1143 ,ijchoi@kimchang.com,"김·장 법률사무소의 최임정 회계사는 세무조사 및 조세쟁송, 사모투자(Private Equity), 부동산·건설 분야에서 조세 자문을 제공하고 있습니다. 주요 고객사로는 Outbound, Venture Capital, Finance 등 다양한 산업분야의 기업들이 있습니다.최 회계사는 약 30년 간 쌓아온 풍부한 자문 경험을 토대로, 특히 고정사업장(Permanent Establishment) 및 수익적 소유자(Beneficial Ownership) 이슈에 대한 자문을 주된 업무로 활동하고 있습니다.부동산 산업팀에도 소속되어 부동산 취득·보유·매각과 관련한 조세자문 자문뿐만 아니라, 자산유동화(ABS), 주택저당증권(MBS), 부동산투자신탁(REIT)과 같은 조세감면을 위한 부동산 취득 및 프로젝트금융투자회사(PFV) 설립 등 부동산 세제혜택과 관련된 다양한 조세 자문 업무를 담당하고 있습니다.최 회계사는 또한 국내·외 M&A 프로젝트에서도 전략적·재정적 투자자는 물론, 다수의 다국적 기업들을 대리해 왔습니다.최 회계사는 The Corporate Tax Planning Law Review (Edition 3) (Law Business Research, 2021)의 한국 섹션, Global Practice Guides (Chambers & Partner, 2017)의 “Corporate Tax 2018 - South Korea” 섹션, Country Tax Portfolio (Bloomberg BNA, 2014-현재)의 “Business Operations in the Republic of Korea” 섹션, Country Analysis (IBFD, 2014-현재)의 “Corporate Taxation - Korea” 및 “Individual Taxation - Korea” 섹션, 그리고 PLC Private Acquisitions Multi-Jurisdictional Guide (Practical Law Company, 2019-2011)의 한국 섹션 등 다수의 서적에 기고하였으며, 2017년 이래로 8년 연속 Chambers Asia Pacific의 조세 부문 Leading Individual로 선정되어 이름을 올리고 있습니다.","조세 +,해외법무,세무조사 및 조세쟁송,금융 및 사모투자 조세,부동산,사모투자,기업인수·합병 세무","김·장 법률사무소 (2003.7.-현재),삼일회계법인 (2002.12.-2003.7.),김·장 법률사무소 (2001.7.-2002.10.),안건회계법인 (1986-1999)","The University of Texas at Austin (석사, 회계학, 2001),서울시립대학교 (석사, 세무관리학, 1999),연세대학교 (경영학사, 1987),제21회 공인회계사 시험 합격 (1986)","외국회계사, 미국 (2001),공인회계사, 대한민국 (1989)","Leading Individual, Chambers Asia-Pacific, Tax: Consultants (Chambers and Partners, 2017-2024),Leading Lawyer, Who’s Who Legal: Korea, Corporate Tax (Who’s Who Legal, 2022-2024)",,"양도소득 및 배당금에 대한 수익적 소유자(Beneficial Ownership) 관련 조세 소송 시 자문,다국적기업 및 사무투자회사의 배당소득에 대한 제한세율 관련 조세 소송 시 자문,주류회사 간 합병 시 세무 구조 및 세무적 관점에 대한 자문,해외 언론사의 고정사업장(Permanent Establishment) 관련 소송 시 자문","한국어, 영어","신주배정 행위계산의 부인 (서울시립대학교 석사논문),The Corporate Tax Planning Law Review (Edition 3, 4): Korea Chapter (공저, Law Business Research, 2021-2022),Corporate Tax 2018 - South Korea, Global Practice Guides (공저, Chambers and Partners, 2017),Business Operations in the Republic of Korea, Country Tax Portfolio (공저, Bloomberg BNA, 2014-2023),Corporate Taxation - Korea, Country Analysis (공저, IBFD, 2014-2023),Individual Taxation - Korea, Country Analysis (공저, IBFD, 2014-2023),PLC Private Acquisitions Multi-jurisdictional Guide: Korea chapter (공저, Practical Law Company, 2009-2011)",https://www.kimchang.com/ko/professionals/view/ijchoi,-
김앤장,최해웅,변호사,02-3703-1986 ,haewoong.choi@kimchang.com,,"기업지배구조·경영권분쟁 +,기업인수·합병 +,사모투자,기업형사·화이트칼라범죄","김·장 법률사무소 (2021-현재),육군법무관 (2018-2021)","제7회 변호사시험 합격 (2018),고려대학교 법학전문대학원 (법학전문석사, 2018),고려대학교 (법학사, 2013)","변호사, 대한민국 (2018)",,,,"한국어, 영어",,https://www.kimchang.com/ko/professionals/view/haewoong.choi,-
김앤장,최희준,변호사,02-3703-1709 ,heejun.choi@kimchang.com,"김·장 법률사무소의 최희준 변호사는 기업인수 및 합병, 사모투자, 자산운용, 해외투자, 증권 및 자본시장 등 기업법무 및 금융 분야에서 법률 자문을 제공하고 있습니다.최 변호사는 국내외 PEF, 다국적기업, 국내 대기업 및 금융기관 등을 대리하여 국내의 주요 M&A Transaction 과 관련한 자문을 제공해 오고 있습니다. 또한, 다년간 해외 운용사들의 국내 투자자들을 상대로 한 펀드 판매 등 규제 관련한 자문을 제공해 오고 있으며, 국내 기관의 펀드를 통한 해외투자와 관련한 법률자문도 제공하고 있습니다. 그 밖에도 최 변호사는 국내사모펀드 설립 관련 업무를 포함하여 사모투자 및 자산운용업 관련 규제에 대한 폭넓은 자문을 제공하고 있습니다.","기업인수·합병 +,사모투자,자산운용,자본시장,증권","김·장 법률사무소 (2008-현재),육군법무관 (2005-2008)","UCLA School of Law (LL.M., 2014),대법원 사법연수원 (34기, 2005),고려대학교 (법학사, 2003),제44회 사법시험 합격 (2002)","변호사, 대한민국 (2005)","Leading Lawyer, Lexology Index: Private Funds (Lexology Index, 2026),Leading Lawyer, Lexology Index: Korea, M&A and Governance (Lexology Index, 2025),Dealmaker of the Year, ALB Korea Law Awards (Asian Legal Business, 2025)",,"기업인수 및 합병]]국내 부동산투자신탁 회사 매각 건 자문,글로벌 PEF의 포괄적 사업양수도를 통한 국내 자동차부품회사 인수 건 자문,글로벌 PEF의 국내 소셜커머스 회사 인수 건 자문,해외 국부펀드의 국내 건설회사 지분 투자 건 자문,국내 타이어 회사의 호주 타이어 회사 인수 건 자문,국내 주류 그룹의 자회사 매각 건 자문,국내 금융회사의 중국 승객운송 플랫폼 회사 투자 건 자문,국내 철강 그룹의 계열회사 간 합병 자문,국내 회사의 영화관 사업 회사 인수 건 자문,해외 PEF의 국내 물류 업체 인수 건 자문,해외 펀드의 공개매수를 통한 국내 배터리 관련 회사 인수 건 자문,글로벌 제약회사의 공개매수를 통한 국내 바이오 회사 인수 건 자문//사모투자(Private Equity)]]국내 블라인드 PEF 설립 업무 대리,국내 PEF의 구인구직업체 인수 건 자문,국내 PEF의 도시광산업체 인수 건 자문,국내 PEF의 공간서비스업체 인수 건 자문,국내 PEF의 제약업체 인수 건 자문,국내 PEF 관련 사원 간 분쟁 대리//자산운용]]역외 펀드의 국내 판매 등 해외 자산운용사의 국내 영업 관련 제반 자문,국내 기관의 해외대체투자 관련 자문,국내 자산운용사의 투자신탁 설정 업무 대리,다수의 역외 펀드 등록 업무 대리,국내 자산운용사의 역외펀드 선물환 관련 분쟁 대리","한국어, 영어","The Private Equity Review (Second edition): Part I, Fundraising - ""Korea” chapter (공저, Law Business Research, 2013),공개매수자의 별도매수, BFL 제55호 (공저, 서울대학교 금융법센터, 2012)",https://www.kimchang.com/ko/professionals/view/heejun.choi,-
김앤장,"크렙스바흐, 앤드류 (Andrew V. KREBSBACH)",외국변호사,02-3703-1477 ,andrew.krebsbach@kimchang.com,,"사모투자,자산운용,증권,부동산","김·장 법률사무소 (2025.11.-현재),Akin Gump Strauss Hauer & Feld LLP, 싱가포르 (2022.1.-2025.10.),Sidley Austin LLP, 시카고 (2018.9.-2021.12.)","Northwestern University Pritzker School of Law (J.D., cum laude, 2018),서강대학교 대학원 (석사과정 수료, 국어국문학과, 2015),University of Michigan (B.A., with distinction, Philosophy and English Literature, 2008)","외국변호사, 일리노이주 (2018)","Singapore Rising Star, Asian Legal Business (2024)",,,"영어, 한국어","Chambers Global Practice Guides - Investment Funds 2026: Korea Chapter (공저, Chambers and Partners, 2026),“How Funds Are Achieving Performance Compensation Equilibrium: Considerations on Hurdles, Benchmarks, High Water Marks and Clawbacks,” The Hedge Fund Law Report (공저, 2020),“How Funds Are Achieving Performance Compensation Equilibrium: Designated Investments, ‘1 or 30’ Structures, Caps and First Loss Arrangements,” The Hedge Fund Law Report (공저, 2020)",https://www.kimchang.com/ko/professionals/view/andrew.krebsbach,-
